title,pdf_link
Copies of notification of the sale of Middlewick Ranges from MOD to Colchester Borough Council,https://assets.publishing.service.gov.uk/media/5a7f9f6140f0b623026909c5/20161011-FOI08796.pdf
"Information on the decision to close Fulwood Barracks, Preston",https://assets.publishing.service.gov.uk/media/5a8174eeed915d74e33fe4f1/20161205-FOI10839.pdf
Number of service family accommodation (SFA) properties in Northern Ireland,https://assets.publishing.service.gov.uk/media/5a814ccee5274a2e87dbcde5/20161215-FOI11012.pdf
Information on hunts and shoots on MOD land,https://assets.publishing.service.gov.uk/media/5a819afa40f0b62302698350/20161215-FOI11014.pdf
Total number of breaches of the section 127 of the Communications Act 2003 recorded by the MOD Police (MDP) for financial years between 2006 and 2016,https://assets.publishing.service.gov.uk/media/5a81531ee5274a2e8ab535dc/20161212_-_Redacted_Reply_to_eCase_11535__RFI_335-16_Re_Total_number_of_breaches_of_the_section_127_of_the_Communications_Act_2003.pdf
Number of ammunition technicians and ammunition technical officers assessed for post-traumatic stress disorder (PTSD) since 2009,https://assets.publishing.service.gov.uk/media/5a7f4fade5274a2e87db514a/20161220-FOI11491_78027_ATO_AT_PTSD_Redacted.pdf
Number and type of offences that resulted in cautions issued by the MOD Police (MDP) for financial years between 2011 and 2016,https://assets.publishing.service.gov.uk/media/5a81b6c5ed915d74e6233c03/20161209_-__Redacted_Reply_to_eCase_10845__RFI_318-16_Re_Number_and_crime_type_of_offences_that_resulted_in_cautions.pdf
Number of claims awarded under the war pension scheme for the condition radiation sickness,https://assets.publishing.service.gov.uk/media/5a7f6ef1ed915d74e622a6d6/FOI2016_10946__1_.pdf
Number of personnel on MOD payroll system managed by non-departmental public bodies,https://assets.publishing.service.gov.uk/media/5a74ed1e40f0b65c0e8459dd/FOI2016_10646__2_.pdf
Veterans UK definition of a veteran,https://assets.publishing.service.gov.uk/media/5a801e3b40f0b62305b8948e/FOI2016_11130_001.pdf
Number of South Atlantic medals without rosette issued since October 2014,https://assets.publishing.service.gov.uk/media/5a7f336bed915d74e6229003/FOI201608664_001.pdf
Information on armed forces fatalities from Chester-Le-Street from 1946 to 2016,https://assets.publishing.service.gov.uk/media/5a801c1ae5274a2e8ab4e3d9/FOI2016_04377_001.pdf
Information on military spouses recorded on joint personnel administration system,https://assets.publishing.service.gov.uk/media/5a759680e5274a43682986c2/FOI2016_09252_001.pdf
No information held on non-British citizens within the armed forces,https://assets.publishing.service.gov.uk/media/5a81581240f0b62302696cbf/FOI2016_09241_001.pdf
Information on misconduct hearings involving MOD Police (MDP) officers,https://assets.publishing.service.gov.uk/media/5a809578e5274a2e87dbaa45/20161212_-_Redacted_Reply_to_eCase_10942_RFI_320-16_Re_Misconduct_Hearings_Redacted.pdf
Career projection for a new entrant Royal Navy chef,https://assets.publishing.service.gov.uk/media/5a816702e5274a2e8ab53cbd/FOI2016_10716__2_.pdf
On promotion and current length of service by Branch for Royal Navy ratings and regular strength for engineering (general service) by specialisation as at 1 September 2016,https://assets.publishing.service.gov.uk/media/5a7f877a40f0b62305b87b33/FOI2016_09904.pdf
No information held on the number of veterans in England aged 70 and under,https://assets.publishing.service.gov.uk/media/5a80e7ebed915d74e62311d3/FOI2016_10909__2_.pdf
Number of RAF personnel by rank,https://assets.publishing.service.gov.uk/media/5a80cae8e5274a2e87dbbd9c/FOI2016_11458.pdf
Personnel joining UK regular forces by sexual orientation during financial 2015 to 2016,https://assets.publishing.service.gov.uk/media/5a74b904e5274a3cb2866a96/FOI2016_10560.pdf
Information on training management officers within Royal Navy (Annex A),https://assets.publishing.service.gov.uk/media/5a814f7ded915d74e62318df/FOI_2016_08325_-_Redacted.pdf
Information on sickness absence within the MOD Police (MDP) for financial years between 2013 and 2017,https://assets.publishing.service.gov.uk/media/5a80bc05e5274a2e8ab51dbf/20161208_Redacted_Reply_eCase_10235_16_Re_MDP_and_civilian_sick_absence_including_mental_health_or_stress_related_conditions.pdf
Information on quick reaction alert (QRA) launch on 16 November 2016,https://assets.publishing.service.gov.uk/media/5a7f70ba40f0b6230268f826/20161208-Quick_Reaction_Alert_Typhoon_Launch_16_Nov_2016.pdf
Unaccounted for in-use MOD firearms from 2013 to 2016,https://assets.publishing.service.gov.uk/media/5a755ac3ed915d6faf2b257e/20161208-FOI2016_10740_-_Details_of_firearms_ammunition_and_other_munitionsweapons_missing_in_the_last_3_years_-_O.pdf
Number of armed forces personnel tested positive for steroids or muscle-gaining supplements from 2012 to 2016,https://assets.publishing.service.gov.uk/media/5a7f553ee5274a2e87db5376/20160923_FOI2016_08614_8615_8617_REDACTED.pdf
Number of soldiers selected for artificer training and medically downgraded from 2013 to 2015 and the number of soldiers selected for late entry commissions in the Royal Logistics Corps and medically downgraded from 2013 to 2016,https://assets.publishing.service.gov.uk/media/5a7f5ebaed915d74e622a0c6/20161207-Artificer_and__RLC_Medical_Downgrade.pdf
Information on the Princess Mary Royal Air Force Nursing Service (PMRAFNS),https://assets.publishing.service.gov.uk/media/5a8019bced915d74e622c785/20161212-FOI-10918-PMRAFNS-Redacted.pdf
Collisions involving Royal Navy submarines in Irish territorial waters and minutes of meetings with the Marine Accident Investigation Branch from 2011 to 2016,https://assets.publishing.service.gov.uk/media/5a81579d40f0b62305b8e6f2/FOI_2016-09562_-_Redacted.pdf
Information on the use of geographic information systems in the army,https://assets.publishing.service.gov.uk/media/5a8172b4ed915d74e6232515/20161213-FOI10394_77960_Response-O.pdf
Information on medications prescribed to Royal Navy submariners,https://assets.publishing.service.gov.uk/media/5a807353ed915d74e33fa7fd/FOI_2016-09651_-_Redacted.pdf
"Inflight noise assessment reports for TriStar, Puma and Chinook aircraft",https://assets.publishing.service.gov.uk/media/5a80e97be5274a2e8ab52dda/20161128-FOI_2016-10331.pdf
Information on military investigation following leaked photographs following an attack on Camp Bastion in September 2012,https://assets.publishing.service.gov.uk/media/5a819959e5274a2e87dbe7db/20161214-FOI_2016-11428.pdf
Information on work to take place at RAF Northolt,https://assets.publishing.service.gov.uk/media/5a75082240f0b6397f35d233/20160913-FOI07863.pdf
Flying hours for RAF aircraft for financial years between 2013 and 2016,https://assets.publishing.service.gov.uk/media/5a7f544fed915d74e6229cd2/20161129-FOI_2016-10515.pdf
Out of service dates and other details of several Royal Navy and Royal Fleet Auxiliary vessels,https://assets.publishing.service.gov.uk/media/5a7f9a3bed915d74e622b75e/FOI_2016-08608_Redacted.pdf
Information on Commander United Kingdom Carrier Strike Group (COMUKCSG),https://assets.publishing.service.gov.uk/media/5a7ff94be5274a2e87db719e/FOI_2016-08721_-_Redacted.pdf
"Information on fruitless payments in excess of £30,000 for financial years between 2013 and 2016",https://assets.publishing.service.gov.uk/media/5a818be6e5274a2e87dbe349/FOI2016-09426_-_Fruitless_payments_in_excess_of__30_000_made_by_or_paid_....pdf
Number of flying hours and maintenance costs for the Typhoon and Tornado fleets between financial years 2014 and 2016,https://assets.publishing.service.gov.uk/media/5a7f488a40f0b6230268e901/20161122-Flying_hours_and_maintenance_costs_for_the_Typhoon_and_Tornado_fleets.pdf
Information on Type 45 Destroyer engines,https://assets.publishing.service.gov.uk/media/5a8088e6ed915d74e33fafac/2016-09186_Redacted.pdf
Information on photographs of the Isle of Man between 1940 and 1960 held at the National Collection of Aerial Photography,https://assets.publishing.service.gov.uk/media/5a7f2fba40f0b62305b859c8/Redacted_MOD_final_response_2016_11365.pdf
Details of RAF helicopter deployments to rescues on the Holy Island causeway from January 2012 to April 2015,https://assets.publishing.service.gov.uk/media/5a750da6ed915d5c544652a6/20161202-FOI_2016-10561.pdf
Information on legionella bacteria and legionnaires diseases at UK military establishments and amongst UK military personnel since 2010,https://assets.publishing.service.gov.uk/media/5a80788840f0b62302693b3b/20160824-FOI07441.pdf
Information on the timeline between march out and dispute resolution at service family accommodation and copy of occupant generated damage summary report relating to the replacement of a garage roller door (Annex A),https://assets.publishing.service.gov.uk/media/5a75895140f0b6397f35f2fb/20160817-FOI07460.pdf
Information on money spent on renewable energy projects since 2010,https://assets.publishing.service.gov.uk/media/5a7ff80ded915d74e622bb1d/20160913-FOI07815.pdf
Number of firearms reported as lost or stolen from HM armed forces 2011 to 2015,https://assets.publishing.service.gov.uk/media/5a81a027ed915d74e623345e/20160926-FOI2016_08086-Guns_weapons_listed_as_lost_or_stolen_from_HM_Armed_Forces_during_the_last_10_years-.pdf
Number of incidents reported to the MOD Police (MDP) of a child being left alone since 2012,https://assets.publishing.service.gov.uk/media/5a8096fa40f0b6230269463f/20161202_-_Redacted_Reply_to_eCase_10743__RFI_315-16_Re_Number_of_incidents_reported_to_MDP_of_children_left_alone.pdf
Number of hate crimes reported to the MOD Police (MDP) between 1 January 2016 and 9 November 2016,https://assets.publishing.service.gov.uk/media/5a750976e5274a59fa716e74/20161205_-_Redacted_Reply_to_eCase_10819_RFI_31716_Re_Hate_Crime.pdf
Number of UK Military Type Certifications,https://assets.publishing.service.gov.uk/media/5a7f4fdce5274a2e8ab4b68d/20161205_-_FOI2016-11617_-_Military_Type_Certificates.pdf
Information on payments made to Developing Markets Associates Ltd and SCL Group Ltd since June 2010,https://assets.publishing.service.gov.uk/media/5a7f442640f0b6230268e74a/FOI2016-08132_-_Payments_made_to_named_Ltd_companies.pdf
Items stolen from military bases in Great Britain in 2015,https://assets.publishing.service.gov.uk/media/5a7f9d2d40f0b623026908e3/FOI2016-07724-Items_reported_stolen_from_military_bases_across_the_UK.pdf
"Information on Op Catan, Op Branta and Op Tramail",https://assets.publishing.service.gov.uk/media/5a80161440f0b623026916d6/FOI2016-07417_-_Op_Catan_Op_Branta_and_Op_Tramail.pdf
Total MOD expenditure for financial year 2015 to 2016 and budget for financial year 2016 to 2017,https://assets.publishing.service.gov.uk/media/5a7fa06e40f0b62302690a2b/FOI2016-09218_-_Spending_on_Defence_education_and_the_environment_per_year.pdf
Information on commissioning applications from junior non-commissioned officers for recruiting year 2008 to 2009,https://assets.publishing.service.gov.uk/media/5a80121ded915d74e33f845f/20161205-FOI-10714-RAF-JNCO-Commissions-Reponse-O.pdf
Information on Royal Navy phase 1 and phase 2 training techniques ,https://assets.publishing.service.gov.uk/media/5a7f775ee5274a2e8ab4c5aa/001.pdf
Information on recruitment and retention payment flying (RRP(F)),https://assets.publishing.service.gov.uk/media/5a758370ed915d6faf2b3947/red-FOI2016_09353-.pdf
Number of cautions issued by the MOD Police (MDP) from 2011 to 2015,https://assets.publishing.service.gov.uk/media/5a803e2aed915d74e33f949f/20161206_-_Redacted_Reply_to_eCase10660_RFI_311_16_Re__Cautions_for_all_crimes.pdf
"Total number of crimes, burglaries and thefts reported to and screened by the MOD Police (MDP) since 2012",https://assets.publishing.service.gov.uk/media/5a74cb5ce5274a3f93b48da3/20161205_Redacted_Reply_to_eCase_10739_RFI_314-16_Re_Discontinued_investigations_into_crimes_burglaries_and_thefts__2_.pdf
Information on Royal Engineers new employment model (NEM) trade group pay supplements,https://assets.publishing.service.gov.uk/media/5a80012ee5274a2e87db7470/20161206-FOI10742_77947_Response-O.pdf
Contact details for the MOD Chief Digital and Information Officer,https://assets.publishing.service.gov.uk/media/5a81afe8ed915d74e33ff8d2/20161109_Redacted_06413.pdf
Information on the Ministry of Defence’s telecommunications services,https://assets.publishing.service.gov.uk/media/5a750ec9e5274a3cb286950e/20161109-Redacted_01018.pdf
Information on sharing of cyber threat intelligence,https://assets.publishing.service.gov.uk/media/5a80022aed915d74e33f7e7c/20161109-Redacted_03006.pdf
Number of MOD staff relocated to MOD Corsham from 2014 to 2016,https://assets.publishing.service.gov.uk/media/5a7500e340f0b6399b2afe4f/20161109-Redacted_03101.pdf
"Information on breaches of security policy, disclosures and unauthorised access",https://assets.publishing.service.gov.uk/media/5a81a4ff40f0b62305b90119/20161109-Redacted_05005.pdf
Information on ISS Symposium Lot 1 contract,https://assets.publishing.service.gov.uk/media/5a7ffc5c40f0b62302690d23/20161109-Redacted_05752.pdf
List of most visited websites by MOD staff from January 2015 to January 2016,https://assets.publishing.service.gov.uk/media/5a74e643ed915d502d6cbe65/20161109-Redacted_05796.pdf
Information on the creation of the information systems and services design authority,https://assets.publishing.service.gov.uk/media/5a7f42ffe5274a2e87db4c7b/20161109-Redacted_06091.pdf
Information on Burlington underground facility,https://assets.publishing.service.gov.uk/media/5a7f253ded915d74e6228aaa/20161109-Redacted_07104.pdf
 Date that Air Cadet Publication (ACP) 5 was last reviewed,https://assets.publishing.service.gov.uk/media/5a75a828e5274a545822d32b/20161102-FOI_2016-09337.pdf
Information on Air Cadet Publication 300 relating to procedures for payment of adult volunteer allowances,https://assets.publishing.service.gov.uk/media/5a801017ed915d74e622c3ff/20161102-FOI_2016-09343.pdf
 Number of safety assurance officers recruited and a copy of their terms of reference (Annex A),https://assets.publishing.service.gov.uk/media/5a81a59040f0b623026986ed/20161102-FOI_2016-09346.pdf
Box one performance appraisal report (PAR) score ranges for the 48 Logistics Readiness Squadron at RAF Lakenheath for reporting year 2015 to 2016,https://assets.publishing.service.gov.uk/media/5a81a039e5274a2e87dbea52/20161104-FOI_2016-09613.pdf
Number of UK regular armed forces suicide and open verdict deaths by year from 2000 to 2015,https://assets.publishing.service.gov.uk/media/5a7f8063e5274a2e8ab4c8e7/PUBLIC_1478708156.pdf
Number and type of firearms reported missing from 2011 to 2016 (Annex A),https://assets.publishing.service.gov.uk/media/5a7f5a9fe5274a2e87db5586/20161108-FOI2016_09452-Details_of_Firearms_reported_missing_and_recovery_during_last_5_years_-_Mr_Ben_Farmer_-Daily_Telegraph__-_o__2_.pdf
Number of quick reaction alert (QRA) launches and calls to cockpit from 2015 to 2016 (Annex A and Annex B),https://assets.publishing.service.gov.uk/media/5a80375c40f0b62302692330/20161103-Quick_Reaction_Alert_launches_and_calls_to_cockpit_from_2005.pdf
Request copy of Typhoon pilot checklists and quick reference handbook,https://assets.publishing.service.gov.uk/media/5a7f2d86e5274a2e8ab4a986/20161108-Typhoon-Pilot-Documentation.pdf
"Number of private aircraft landing at Leuchars Station by week for financial years 2014/15, 2015/16 and 2016/17",https://assets.publishing.service.gov.uk/media/5a7ffe8940f0b62302690e03/20161109-Private-aircraft-visiting-Leuchars_since_2014.pdf
Number of recruits across the single services that complete their first stage of training and the number that do not complete their stage of training,https://assets.publishing.service.gov.uk/media/5a80537be5274a2e8ab4f810/20161110_FOI2016_09557_09558_09560_REDACTED.pdf
Number of injuries sustained by registered nursing staff whilst on training and exercise by year and rank from 2013 to 2016,https://assets.publishing.service.gov.uk/media/5a80b0d640f0b62302694f4b/PUBLIC_1478535198.pdf
No information held on the number of Hong Kong laundrymen employed on Royal Navy and Royal Fleet Auxiliary (RFA) ships,https://assets.publishing.service.gov.uk/media/5a801fa740f0b62302691a7d/001.pdf
Information on collisions between Royal Navy vessels and Soviet Union vessels from 1950 to 1990,https://assets.publishing.service.gov.uk/media/5a80a802e5274a2e8ab51690/09714.pdf
"Information on RAF Typhoon ZJ940, ZJ945 and ZJ948",https://assets.publishing.service.gov.uk/media/5a7f1ea5e5274a2e87db3ea4/20161108-Use_of_Typhoon_Aircraft_for_Spare_Parts.pdf
Information on MOD Police (MDP) training budget and use of firearms by officers,https://assets.publishing.service.gov.uk/media/5a8075f3ed915d74e622e952/20161108_-_Redacted_Response_to_eCase_09556_RFI_282_Re_Firearms_Budget_and_Incidents.pdf
"Number of complaints of discrimination to the British Army under the Equalities Act 2010 for financial years 2013/14, 2014/15 and 2015/16 (Annex A)",https://assets.publishing.service.gov.uk/media/5a801a2aed915d74e622c7a8/20161114-Army_Claims_Complaints-AF.pdf
Information on how to apply for service records of deceased service personnel,https://assets.publishing.service.gov.uk/media/5a819da840f0b6230269843f/20161114-Army_Records_WW1-AF.pdf
Career progression rates for warfare specialist (abovewater warfare tactical) ratings with 7 years length of service,https://assets.publishing.service.gov.uk/media/5a7f88ba40f0b6230269011d/PUBLIC_1479135884.pdf
Number of candidates eligible for promotion to sergeant up to warrant officer class 1 in the Royal Artillery and number of medical gradings for 2014 and 2015 (Annex A),https://assets.publishing.service.gov.uk/media/5a7f6f66ed915d74e33f669a/20161114-RA_Prom_Medical-AF.pdf
Number of late entry commissions to the Royal Armoured Corps by year from 2011 to 2015,https://assets.publishing.service.gov.uk/media/5a8193ec40f0b62305b8fb4e/20161114-RAC_Late_Entry_Commissions-AF.pdf
Information on army service complaints,https://assets.publishing.service.gov.uk/media/5a80b69aed915d74e6230048/20161114-Army_Service_Complaints-AF.pdf
Number of Royal Army Medical Corps (RAMC) operating department practitioners (ODP) who applied for late entry (LE) commissions and success rates from 2013 to 2015,https://assets.publishing.service.gov.uk/media/5a74b038ed915d7ab83b5be9/20161114-RAMC_Operating_Dept_Practitioners-AF.pdf
Number of Royal Logistic Corps officers considered for conversion and success rates from 2013 to 2015,https://assets.publishing.service.gov.uk/media/5a80eedbe5274a2e87dbca2e/20161114-RLC_DE_Officers-AF.pdf
Number of warrant officer 1 posts within the Royal Artillery ,https://assets.publishing.service.gov.uk/media/5a7f92c840f0b62305b87f6d/20161114-Royal_Artillery_Posts-AF.pdf
Number of promotions to sergeant up to warrant officer class 1 in the Royal Artillery and number of medical gradings from 2010 and 2015 (Annex A),https://assets.publishing.service.gov.uk/media/5a74dc27e5274a3cb2867c3b/20161114-Royal_Artillery_Promotion-AF.pdf
Amount paid to PA Consulting Group for work on RAF Think to Win initiative,https://assets.publishing.service.gov.uk/media/5a80dfc340f0b62302695fc5/20161114-FOI_2016-09875.pdf
Number of referrals regarding safeguarding matters made by Nottinghamshire Army Cadet Force (ACF) to the Disclosure and Barring Service (DBS) since 2010,https://assets.publishing.service.gov.uk/media/5a80b453e5274a2e87dbb59f/20161114-FOI09886.pdf
Number of MOD Police (MDP) officers that retired while under suspension from 2011 to 2016,https://assets.publishing.service.gov.uk/media/5a7f2ecde5274a2e8ab4aa02/20161110_-_Redacted_Response_to_eCase_09564_FOI_279-16_Re_Suspended_Staff.pdf
Nationality of armed forces personnel as of April 2015 and April 2016,https://assets.publishing.service.gov.uk/media/5a74f414e5274a3cb2868847/PUBLIC_1478183740.pdf
Number of early termination application submissions for RAF medics (Annex A),https://assets.publishing.service.gov.uk/media/5a816cdfe5274a2e87dbd8f1/20161104-FOI-09433-RAF-Medic-Termination-Submissions-Response.pdf
Fuel spend on Royal Navy type 23 frigates and type 45 destroyers for financial year 2015 to 2016,https://assets.publishing.service.gov.uk/media/5a80e8baed915d74e623121c/001.pdf
Liability and strength of RAF medic sub-trade from 2013 to 2016,https://assets.publishing.service.gov.uk/media/5a80aa2ae5274a2e8ab51764/20161108-FOI-09435-RAF-Medica-Posts-Vs-Manning_-Levels-Response-Redacted.pdf
Information on recruits within the RAF general technician electrical trade,https://assets.publishing.service.gov.uk/media/5a81a281e5274a2e87dbeb06/20161108-FOI-09878-Pass-Fail_Rate-GEN_Tech_E.pdf
No information held on weapons and ammunition seized or discovered by HMS Diamond 1 September to 27 October 2016,https://assets.publishing.service.gov.uk/media/5a805558ed915d74e33f9d39/001__2_.pdf
Number of serving armed forces personnel with nut allergies,https://assets.publishing.service.gov.uk/media/5a8169f0ed915d74e33fe13d/PUBLIC_1478618695.pdf
The number of female army officers from 1985 to 1995,https://assets.publishing.service.gov.uk/media/5a80aae8ed915d74e33fbb9f/20161109-FOI09842_77699__2_.pdf
Number of Royal Marines medically downgraded ranks from 2010 to 2016,https://assets.publishing.service.gov.uk/media/5a80f33340f0b62305b8e10d/PUBLIC_1478688986.pdf
"Number of personnel in each army infantry regiment in the UK by rank for 2011, 2015 and 2016",https://assets.publishing.service.gov.uk/media/5a800a79ed915d74e33f8182/FOI08699-77678_Stats_Infantry-O.pdf
Expenses claims by MOD civilian staff from 2013 to 2015,https://assets.publishing.service.gov.uk/media/5a80157c40f0b62302691699/20160602-MOD_civilian_expenses_claims_from_1_Jan_13_to_31_Dec_15__2_.pdf
"Attachment: Expenses claims by MOD civilian staff for January, February and March 2013",https://assets.publishing.service.gov.uk/media/5a8070d540f0b62302693859/20160601-JAN-MARCH_2013.xls
"Attachment: Expenses claims by MOD civilian staff for April, May and June 2013",https://assets.publishing.service.gov.uk/media/5a80e47440f0b6230269617c/20160601-APR-JUN_2013.xls
Attachment: Expenses claims by MOD civilian staff for July August and September 2013,https://assets.publishing.service.gov.uk/media/5a8059a9ed915d74e622df34/20160602-JUL-SEPT_2013.xls
Attachment: Expenses claims by MOD civilian staff for October November and December 2013,https://assets.publishing.service.gov.uk/media/5a80b0c4ed915d74e33fbdb3/20160602-OCT-DEC_2013.xls
"Attachment: Expenses claims by MOD civilian staff for January, February and March 2014",https://assets.publishing.service.gov.uk/media/5a80aa56ed915d74e33fbb6b/20160602-JAN-MARCH_2014.xls
"Attachment: Expenses claims by MOD civilian staff for April, May and June 2014",https://assets.publishing.service.gov.uk/media/5a7585d340f0b6360e474c37/20160602-APR-JUN_2014.xls
Attachment: Expenses claims by MOD civilian staff for July August and September 2014,https://assets.publishing.service.gov.uk/media/5a8053e5ed915d74e33f9cb2/20160602-JULY-SEP_2014.xls
Attachment: Expenses claims by MOD civilian staff for October November and December 2014,https://assets.publishing.service.gov.uk/media/5a80d56240f0b62305b8d686/20160602-Oct-Dec_2014.xls
"Attachment: Expenses claims by MOD civilian staff for January, February and March 2015",https://assets.publishing.service.gov.uk/media/5a805d3fe5274a2e87db9647/20160602-JAN-MARCH_2015.xls
"Attachment: Expenses claims by MOD civilian staff for April, May and June 2015",https://assets.publishing.service.gov.uk/media/5a8065fae5274a2e8ab4fea9/20160602-APR-JUN_2015.xls
Attachment: Expenses claims by MOD civilian staff for July August and September 2015,https://assets.publishing.service.gov.uk/media/5a7f6456ed915d74e622a2dd/20160602-JULY-SEP_2015.xls
Attachment: Expenses claims by MOD civilian staff for October November and December 2015,https://assets.publishing.service.gov.uk/media/5a7f308a40f0b6230268dfc2/20160602-OCT-DEC_2015.xls
Number of armed forces personnel that have undergone various weight loss procedures since 2012,https://assets.publishing.service.gov.uk/media/5a80c0dfed915d74e33fc378/PUBLIC_1477297221.pdf
Request copy of annual compendium of RAF manpower statistics 2015 and 2016,https://assets.publishing.service.gov.uk/media/5a7f1a8f40f0b62305b85183/PUBLIC_1577300991.pdf
Information on the Royal Navy fisheries protection squadron,https://assets.publishing.service.gov.uk/media/5a8183bc40f0b62302697b94/001.pdf
Number of quick reaction alerts (QRA) from 1 January 2016 to 30 September 2016,https://assets.publishing.service.gov.uk/media/5a817bfaed915d74e33fe757/20161024-RAF_Quick_Reaction_Alert_Launches_between_1_January_and_30_Sep_2016.pdf
Number of MOD Police (MDP) charges and cautions relating to the possession of cannabis from 2011 to 2016 (Annex A),https://assets.publishing.service.gov.uk/media/5a7ffe5740f0b62305b88879/20161021_-Redacted_Reply_to_eCase_09501__RFI_277-16_Re_Cannabis_Possession.pdf
Type of Russian aircraft involved in quick reaction alerts (QRA) on 12 and 17 October 2016,https://assets.publishing.service.gov.uk/media/5a819cefe5274a2e8ab54ee7/20161026-09757.pdf
"Information on the future of Stonehouse Barracks, Plymouth",https://assets.publishing.service.gov.uk/media/5a7f9840ed915d74e33f764b/2016-09498_redacted_scanned.pdf
Number of private aircraft landing at Leuchars Station between 30 September and 10 October 2016,https://assets.publishing.service.gov.uk/media/5a74e21340f0b65c0e845401/20161028-Private-Aircraft-Visiting-Leuchars_between_30_September_and_10_October_2016.pdf
Information on armed forces discharges from the rank of Warrant Officer 1 or equivalent and below,https://assets.publishing.service.gov.uk/media/5a808a7ce5274a2e87dba65c/PUBLIC_1476362450.pdf
Information on expected charitable status within the Air Cadet Organisation (ACO),https://assets.publishing.service.gov.uk/media/5a7f115640f0b62305b84de5/20160914-FOI-ACO-CivCom-Excepted-Charity-O.pdf
