title,pdf_link
Details of MOD provider of Information Asset Register (IAR),https://assets.publishing.service.gov.uk/media/5a804411e5274a2e8ab4f280/20151214-Redacted_10057.pdf
"UK armed forces personnel accommodated at the Victoria hotel, Silema, Malta",https://assets.publishing.service.gov.uk/media/5a74e97c40f0b65c0e8457dd/20151217-FOI2015_10521_Hotel_accommodation_in_Malta.pdf
List of all requests for ExSUL from MOD civil servants to accompany their spouses on UK and overseas postings 1 April 2014 to 19 October 2015,https://assets.publishing.service.gov.uk/media/5a8031d4ed915d74e33f901b/20151116-Details_of_requests_for_ExSUL_from_MOD_civil_servants.pdf
Average clearance time for War Pension applications and Supplementary Allowance claims as at 31 October 2015,https://assets.publishing.service.gov.uk/media/5a7f98d840f0b62305b881bd/20151216-Clearance_dates_of_War_Pensions_Scheme.pdf
List of Royal Navy and Royal Fleet Auxiliary ships that qualified for the Naval General Service (NGS) medal 1915-1962 clasp 'Canal Zone',https://assets.publishing.service.gov.uk/media/5a7f9dfc40f0b62305b883c9/20151218-List_of_RN_RFA_ships_qualified_for_NGSMedal_1915-1962_Clasp_Canal_Zone.pdf
MOD Police fleet vehicle purchases and maintenance 1 January 2014 to 31 October 2015,https://assets.publishing.service.gov.uk/media/5a751712e5274a59fa717521/20151218_REDACTED_Reply_eCase_2015-10330_Re_MDP_Vehicle_Fleet_Information.pdf
"Copy of the MPM 57A, Medical adjudication and policy statements",https://assets.publishing.service.gov.uk/media/5a7f5c54e5274a2e8ab4bb62/20151223-MPM_57A_and_Medical_Adjudication_and_Policy_statements.pdf
Attachment: Veterans Agency Medical Adjudication guidance,https://assets.publishing.service.gov.uk/media/5a804a07e5274a2e87db8f4b/Veterans_Agency_Medical_Adjudication_Guidance.pdf
Attachment: War Pensions medical advisers instructions and procedures manual,https://assets.publishing.service.gov.uk/media/5a80202ce5274a2e8ab4e546/WPMA_instructions_Optimized.pdf
Attachment: Veterans Agency medical handbook,https://assets.publishing.service.gov.uk/media/5a7f9e53ed915d74e622b8d4/MPM57A-Veterans_Agency_Medical_Handbook.pdf
Details of operations to destroy chemical weapons in the MND(SE) AOR 2005 to 2006,https://assets.publishing.service.gov.uk/media/5a806e96ed915d74e622e69d/20151207-FOI2015_06562_Destruction_of_chemical_weapons_Afghanistan.pdf
"Attachment: CBRN (Chemical, Biological, Radiological and Nuclear) site recce report dated 16 January 2006 ",https://assets.publishing.service.gov.uk/media/5a804ebded915d74e33f9acb/20151208-CBRN_Site_Recce_Report-16Jan06.pdf
"Attachment: MND(SE) (Multi-National Division(SE)) CBRN site survey report Operation Bedouin I, 16 January 2006",https://assets.publishing.service.gov.uk/media/5a80c398ed915d74e62304fb/20151208-MND_SE__CBRN_site_survey_report-OP-Bedouin.pdf
"Attachment: MND(SE) CBRN site survey report Operation Bedouin I, 16 January 2006",https://assets.publishing.service.gov.uk/media/5a81757740f0b623026976b6/20151208-MND_SE__CBRN_site_survey_report-OP-Bedouin_II.pdf
Attachment: Op Bedouin 2 BDO report,https://assets.publishing.service.gov.uk/media/5a75ade940f0b67f59fcec40/20151208-OP-Bedouin-2_BDO_Report.pdf
Attachment: Post operation report Op Bedouin,https://assets.publishing.service.gov.uk/media/5a7f5a2840f0b62305b869f9/20151208-Post_Operation_Report-OP_Bedouin.pdf
"Conversion of commissions in the RAMC (Royal Army Medical Corps), QARANC (Queen Alexandra's Royal Army Nursing Corps) and RADC (Royal Army Dental Corps)",https://assets.publishing.service.gov.uk/media/5a81b87be5274a2e8ab557fd/20151222-ArmyMedical_Commission_Conversion-AF.pdf
"Royal Signals LE (Late Entry) Commissions 2012, 2013 and 2014",https://assets.publishing.service.gov.uk/media/5a805e28ed915d74e33fa05e/20151222-Royal_Signals_Commissions-AF.pdf
"Member of the REME (Royal Electrical and Mechanical Engineers) redundancy, medical discharge, held strength and promotion 2009 to 2015",https://assets.publishing.service.gov.uk/media/5a8198bc40f0b62302698288/20151222-REME_Service-AF.pdf
Royal Signals training in 2014,https://assets.publishing.service.gov.uk/media/5a801ea8e5274a2e87db7f78/20151222-Royal_Signals_Training-AF.pdf
Number of service personnel granted involuntary 'INVOL' status in relation to their service in Northern Ireland 1 March 2014 to 31 October 2015,https://assets.publishing.service.gov.uk/media/5a8155a6ed915d74e6231b03/20151211-FOI2015_10889_NI_Invol_Sep_status.pdf
Gurkha offer to transfer booklet for retired members and amendments made to the pension policy instruction,https://assets.publishing.service.gov.uk/media/5a7ffc27e5274a2e8ab4d7d8/20151207-FOI2015_10065-Gurkha_Pensions-Redacted.pdf
"Information on the Wessex helicopter crash near Setermoen, December 1983",https://assets.publishing.service.gov.uk/media/5a80f3eee5274a2e87dbcbf8/2015-10924_response_redacted.pdf
Financial redress for Gurkha officers and soldiers who have been financially disadvantaged from pensions transferred to AFPS,https://assets.publishing.service.gov.uk/media/5a7f3ca040f0b6230268e46e/20151211_Final_FOI2015-10069.pdf
Attachment: Internal dispute regarding Gurkha pension transfer to AFPS,https://assets.publishing.service.gov.uk/media/5a80c39eed915d74e62304fd/20141218_Veterans_UK.pdf
Attachment: Financial redress for maladministration guide,https://assets.publishing.service.gov.uk/media/62d91ff68fa8f50c03918871/FRFM.pdf
Knee pain excludes potential recruits from the joining the armed forces,https://assets.publishing.service.gov.uk/media/5a7f433a40f0b6230268e6ed/20151214_FOI10419_Knee_Pain.pdf
"Number of ships to be based at Mina Salman and number of personnel permanently stationed there. Total number of personnel expected upon completion of UK MSSF, Kingdom of Bahrain",https://assets.publishing.service.gov.uk/media/5a8061e340f0b62305b8ad35/20151214-FOI2015_10140_Basing_expectations_at_UK_MSSF_Bahrain.pdf
Armed forces ill health pension and the processing of other state benefits ,https://assets.publishing.service.gov.uk/media/5a75846040f0b6397f35f0a2/20151117-FOI2015-010036.pdf
British armed forces visits to educational institutions for recruitment and marketing purposes,https://assets.publishing.service.gov.uk/media/5a80444bed915d74e622d743/20150210-FOI2015_10144_2.pdf
Information on the digital forensics service provided by the MOD Police 2011 to 2015,https://assets.publishing.service.gov.uk/media/5a80860040f0b62305b8ba5c/20151214-REDACTED_Reply_eCase_10131-15-Digital_Forensics_Redacted.pdf
Number of dentist members in the Defence Dental Service and gender make-up,https://assets.publishing.service.gov.uk/media/5a805623ed915d74e33f9d73/FOI_2015_10071-R.pdf
"Payscales for MOD Police constables, sergeants and inspectors",https://assets.publishing.service.gov.uk/media/5a80f3eeed915d74e623160c/20151214_REDACTED_Reply_eCase_11232-15_Re_MDP_Constable_Sergeant_Inspector_pay_scales.pdf
"Attachment: MOD Police constables, sergeants and inspectors pay scales",https://assets.publishing.service.gov.uk/media/5a800eeee5274a2e8ab4def0/20151214_Annex_A_to_reply_to_eCase_11232-15.pdf
Number of sick days taken by MOD Police officers 2013/14 to 2014/15,https://assets.publishing.service.gov.uk/media/5a7f6144e5274a2e8ab4bd44/20151202_REDACTED_Reply_eCase_09715-15_Re_Number_of_sick_days_for_MDP_Officers.pdf
Copy of the Gurkha offer to transfer (GOTT) policy instruction ,https://assets.publishing.service.gov.uk/media/5a7f56fbe5274a2e8ab4b952/20151207-FOI2015_10105-Gurkha_Pensions-Redacted.pdf
Attachment: Pensions policy instruction for pensions offer to transfer to serving and retired Gurkhas,https://assets.publishing.service.gov.uk/media/5a800d0940f0b62305b88e12/20090727-Pensions_Policy_Instruction_final-Redacted.pdf
Total number of armed and unarmed Reaper missions in Syria and Iraq from 8 October 2014,https://assets.publishing.service.gov.uk/media/5a804cb9e5274a2e8ab4f5a7/201501215-FOI2015_10495_Reaper_missions_Iraq_Syria-CORRECTED.pdf
Number of in service UK armed forces deaths by Cancer type 1984 to 2014. Number of UK armed forces personnel that have had a clinical code entered into their primary care record relating to 'neoplasms' January 2007 to October 2015,https://assets.publishing.service.gov.uk/media/5a7f277eed915d74e33f4ab5/PUBLIC_1450276904.pdf
"Cost for MOD cars with police markings broken down for MOD Police, Royal Military Police, RAF Provost and Security Services and the navy equivalent",https://assets.publishing.service.gov.uk/media/5a7f9243ed915d74e33f7412/20151217-FOI2015_10843_police_cars_spend_publish-O.pdf
Cost of MOD Senior Civil Service Conference on 3 November 2015 at 8 Northumberland Avenue,https://assets.publishing.service.gov.uk/media/5a80a790ed915d74e33fba7e/20151217_FOI2015_11373.pdf
List of MOD 'A' (armoured) vehicles and associated material asset codes,https://assets.publishing.service.gov.uk/media/5a8091baed915d74e622f353/Scan_Vehicle_Codes_Redacted.pdf
Attachment: List of 'A' vehicles and associated material asset codes,https://assets.publishing.service.gov.uk/media/5a7f455e40f0b6230268e7c5/20151217-Vehicles.pdf
RAF Regiment No.2 Squadron conducts the RAF Pre-Parachute selection course,https://assets.publishing.service.gov.uk/media/5a819b42ed915d74e62332bf/20151214-FOI-Parachute-Training-O.pdf
The 'Family Test' as part of MOD's policy making process,https://assets.publishing.service.gov.uk/media/5a80bbbeed915d74e623022f/20151216-FOI2015_10510-Family_Test-redacted.pdf
Reduction of the the Military Provost Guard Service to be considered by MOD,https://assets.publishing.service.gov.uk/media/5a803403e5274a2e8ab4ec93/20151217-FOI_MPGS_Reductions_Redacted.pdf
Copy of reports regarding works carried out at a DIO residential property 5 April to 1 August 2015,https://assets.publishing.service.gov.uk/media/5a74900a40f0b616bcb177c5/20151119-FOI09462.pdf
Sweets Way properties leasehold interest,https://assets.publishing.service.gov.uk/media/5a7f3855e5274a2e87db4870/20151119-FOI09567.pdf
Build date of MOD housing properties contstructed in Plymouth since 1900,https://assets.publishing.service.gov.uk/media/5a7f3c6740f0b62305b85e98/20151119-FOI09621.pdf
Number of MOD properties loft insulated to 270 millimetres with a postcode CT21 6QS,https://assets.publishing.service.gov.uk/media/5a815793e5274a2e87dbd1b9/20151120-FOI09924.pdf
"Electricty meter readings for MOD property Alte Brennerei 8, Hutshenhausen, Germany July 2010 to September 2015",https://assets.publishing.service.gov.uk/media/5a8064f3ed915d74e622e33d/20151120-FOI09942.pdf
Number of MOD civilian staff suspended from work for disciplinary reasons 2012 to 2015,https://assets.publishing.service.gov.uk/media/5a814ddc40f0b62302696942/20151126-Number_civilian_staff_suspended_for_disciplinary_reasons_2012-15.pdf
Number of UK quick response alerts to Russian long range aviation 1 January to 1 November 2015,https://assets.publishing.service.gov.uk/media/5a7f784e40f0b6230268faff/20151123-RAF_QRA_Launches_January_to_October_2015.pdf
Number of recorded Non-freezing cold injuries (NFCI) for the UK armed forces 2010 to 2015,https://assets.publishing.service.gov.uk/media/5a7f873840f0b62305b87b1a/PUBLIC_1448967672.pdf
Creation of the CFA and posts included in the Headquarters Field army structure and army command,https://assets.publishing.service.gov.uk/media/5a80bd1de5274a2e8ab51e20/20151201-FOI201510480_76137_CFA_Restructure_ArmySec.pdf
Number of photographers from MOD personnel seconded to Downing Street 2013 to 2015,https://assets.publishing.service.gov.uk/media/5a80db73e5274a2e8ab528e4/FOI2015_08496.pdf
Personnel and assets deployed for Exercise Bersama Shield 2015,https://assets.publishing.service.gov.uk/media/5a81986940f0b62305b8fcd0/FOI2105_08452.pdf
Information about the Red Arrows,https://assets.publishing.service.gov.uk/media/5a7f16aaed915d74e6228502/20151109-The_Red_Arrows-Various.pdf
Number of enemy combatants killed in RAF airstrikes in Iraq June to October 2015,https://assets.publishing.service.gov.uk/media/5a80b84fe5274a2e87dbb6ef/20151208-FOI2015_09737_Iraq-enemy_combatants_killed_in_RAF_airstrikes.pdf
"Information on the Wessex helicopter crash near Setermeon, December 1983",https://assets.publishing.service.gov.uk/media/5a7562fded915d7314959903/2015-10924_redacted_scanned.pdf
"Attachment: Report by the accident investigation Unit on the Wessex helicopter crash near Setermeon, December 1983",https://assets.publishing.service.gov.uk/media/5a80a1b2ed915d74e33fb88b/Air_Accident_Investigation_redacted_scanned.pdf
"Number of people signing up as army recruits, location of their training and total cost per recruit 2005 to 2015",https://assets.publishing.service.gov.uk/media/5a80de3d40f0b62305b8d9a2/Army_Intake_Totals_Training_Locations_and_Costs.pdf
"Number of British soldiers, seamen and airmen detained at the Military Corrective Training Centre (MCTC), Colchester, Essex as at 31 October 2015",https://assets.publishing.service.gov.uk/media/5a80830d40f0b62305b8b942/Detainees_Military_Corrective_Training_Centre_Colchester.pdf
Percentage of Royal Engineer Lance Corporals promoted to Corporal and Corporals promoted to Sergeant at each of their 1st to 5th looks,https://assets.publishing.service.gov.uk/media/5a8149ee40f0b62305b8e224/Document4.pdf
Copy of the minutes of the Atomic Weapons Establishment (AWE) annual review of safety meeting 2014,https://assets.publishing.service.gov.uk/media/5a808b8a40f0b62305b8bc52/FOI2015_03576_AWE_annual_review_safety_meeting_2014.pdf
Attachment: Atomic Weapons Establishment (AWE) Annual Review of Safety 2014 report,https://assets.publishing.service.gov.uk/media/5a819480e5274a2e87dbe634/20151001_Whitham_FOI_2015-03576__AWE_Annual_Review_of_Safety_2014-Redacted_Copy.pdf
Number of MOD Police incidents recorded as a mental health type,https://assets.publishing.service.gov.uk/media/5a7f394ded915d74e33f5195/20151125-REDACTED_Reply_to_eCase_09912_RFI_23615_Re_Mental_Health.pdf
Number of British Army personnel who been diagnosed or treated for a mental health disorder 2011 to 2015,https://assets.publishing.service.gov.uk/media/5a7f73fbe5274a2e87db5f1e/PUBLIC_1449583442.pdf
Number of personnel and veterans who received a lump sum payment under AFCS as at 30 September 2014 and number of ex-service personnel in receipt of a War Pension under WPS as at 31 March 2014,https://assets.publishing.service.gov.uk/media/5a80150a40f0b62305b89100/20151209-Redacted_FOI.pdf
Number of elasticated cordage injuries sustained to MOD personnel April 2010 to March 2015,https://assets.publishing.service.gov.uk/media/5a803a2540f0b6230269243a/20151209-redacted_08437_FOI.pdf
RFA Argus and RFA Diligence out of service dates and planned replacements for both vessels,https://assets.publishing.service.gov.uk/media/5a7f1cce40f0b6230268d829/2015-10463_FOI_Request.pdf
"Inquiry by the Royal Military Police to identify army officer who stated a future Labour government would face ""a mutiny"" as quoted in a number of newspapers",https://assets.publishing.service.gov.uk/media/5a818708ed915d74e33feb1b/20151209-FOI10282_76071.pdf
"Number of service personnel discharged for being overweight from the British Army 2013 to 2014, Royal Navy and Royal Air Force 2002 to 2014",https://assets.publishing.service.gov.uk/media/5a7f277440f0b62305b8568a/FOI2015_10043.pdf
Number of casualties (killed and wounded) as a result of FLOSY kinetic action 1964 to 1968,https://assets.publishing.service.gov.uk/media/5a80bf0fed915d74e33fc2cc/PUBLIC_1449756657.pdf
Number of DNA samples the MOD Police have taken from children aged 0 to 15 from January 2010 to 21 November 2015,https://assets.publishing.service.gov.uk/media/5a7590b8e5274a545822c817/20151209-REDACTED_Reply_eCase_10417-15-DNA.pdf
List of countries and number of airstrikes conducted in each by the UK. Number of enemy combatants and civilians/non-combatants killed during the airstrikes,https://assets.publishing.service.gov.uk/media/5a7f8a61e5274a2e87db676e/20151123_FOI2015-09396_airstrikes_via_drones.pdf
Copy of 'Climatic illness and injury awareness and prevention' safety advice,https://assets.publishing.service.gov.uk/media/5a748a31e5274a7f9c586ce4/20151110-FOI2015-09667.pdf
Attachment: Urgent safety advice: climatic illness and injury awareness and prevention,https://assets.publishing.service.gov.uk/media/5a801cf4e5274a2e8ab4e422/20151109-Urgent_Safety_Advice_doc.pdf
Total number of unarmed and armed Reaper missions in Iraq and Syria,https://assets.publishing.service.gov.uk/media/5a80a216ed915d74e622f942/20151120-FOI2015_09328_Reaper_missions_Iraq_Syria.pdf
Sleepwalking and other sleep related disorders that disqualify entry to the Royal Navy,https://assets.publishing.service.gov.uk/media/5a807406ed915d74e622e89f/2015-09223-Redacted.pdf
Hiring of venues for MOD staff for recreational purposes 2013 to 2015,https://assets.publishing.service.gov.uk/media/5a7f5e5940f0b6230268f13b/FOI2015_09699.pdf
List of private road transport companies that supply MOD with abnormal load transportation in England January 2012 to November 2015,https://assets.publishing.service.gov.uk/media/5a74fcfc40f0b6399b2afc66/FOI2015-10117.pdf
Copy of the defence deer management procedures,https://assets.publishing.service.gov.uk/media/5a7f9c0ce5274a2e8ab4d377/20151002-FOI08066.pdf
Attachment: Defence deer management procedures,https://assets.publishing.service.gov.uk/media/5a7f691b40f0b62305b86fb7/20151002-FOI08066-AnnexA.pdf
Attachment: Defence deer management procedures amendments ,https://assets.publishing.service.gov.uk/media/5a755cc8e5274a3cb2869d4d/20151002-FOI08066-AnnexB.pdf
Number of army personnel living in SSA/SFA and have moved house in 2014 and 2015 to another SSA/SFA,https://assets.publishing.service.gov.uk/media/5a805e83ed915d74e622e0df/20151027-FOI08428.pdf
Number and type of accommodation at Waterbeach Barracks and availability to rent or buy,https://assets.publishing.service.gov.uk/media/5a81ae94e5274a2e87dbef0e/20151104-FOI08732.pdf
List of MOD properties currently empty in Greater London,https://assets.publishing.service.gov.uk/media/5a74eb36ed915d3c7d528f8a/20151118-FOI09232.pdf
Attachment: Borough and type of MOD properties currently empty in Greater London,https://assets.publishing.service.gov.uk/media/5a80d209e5274a2e8ab5259f/20151118-FOI09232-Annex.pdf
"Granted office space for James Lockyer Associates (JLA) at RAF St Mawgan, Cornwall",https://assets.publishing.service.gov.uk/media/5a7f3b4fe5274a2e87db499b/20151119-FOI09315.pdf
"Copy of the ADATS level 2 assessment of radar visibility and copy of the RAF air command operational assessment for Cloich Forest, Hag Law and Kilrubie wind farm proposals",https://assets.publishing.service.gov.uk/media/5a81aff240f0b62305b904c1/20151119-FOI09416.pdf
Attachment: Cloich Forest wind farm development proposal,https://assets.publishing.service.gov.uk/media/5a8190d2ed915d74e6232f46/20151119-FOI09416_Cloich_Forest.pdf
Attachment: South east of Halmyre Mains farmhouse wind farm development proposal,https://assets.publishing.service.gov.uk/media/5a803ed1ed915d74e622d523/20151119-FOI09416_Halmyre_Mains_Farmhouse.pdf
Attachment: Kilrubie wind farm proposals,https://assets.publishing.service.gov.uk/media/5a80a598ed915d74e622fa68/20151119-FOI09416_Kilrubie.pdf
Companies that responded to an invitation to tender for the RAF Northolt premier passenger service tender issued 31 March 2015,https://assets.publishing.service.gov.uk/media/5a8067eee5274a2e8ab4ff56/20151123-FOI09354.pdf
"Project directory for all companies, suppliers and sub-contractors involved in the Beacon Barracks, Beaconside, Stafford project",https://assets.publishing.service.gov.uk/media/5a81762140f0b623026976f2/20151119-FOI09418.pdf
"Attachment: List of sub-contractors, sub-consultants and suppliers for the redevelopment of Beacon Barracks, Stafford contract",https://assets.publishing.service.gov.uk/media/5a8059b740f0b62302692fb9/20151119-FOI09418-Annex.pdf
"Copy of reports into HMS Cornwall personnel captured by Iranian forces, March 2007 and Board of Inquiry into 6 Royal Marines and 2 Royal Navy sailors captured by Iranian forces, June 2004",https://assets.publishing.service.gov.uk/media/5a8171e5e5274a2e87dbdaa7/20151202-Redacted_Response_FINAL.pdf
"Attachment: Inquiry into the apprehension of 15 RN/RM personnel from HMS Cornwall by Iranians, 23 March 2007",https://assets.publishing.service.gov.uk/media/5a801cf840f0b62305b8940e/20151120-Report_Redacted-FINAL_Redacted.pdf
"Attached: Learning account into the RNTT (Royal Navy training team) border incident, Shatt Al Arab waterway 21 June 2004",https://assets.publishing.service.gov.uk/media/5a81592640f0b62302696d1c/20151120-Shaat_Al_Arab_Learning_Account_Redacted.pdf
"Attached: Learning account into the RNTT (Royal Navy training team) border incident, Shatt Al Arab waterway 21 June 2004, supplementary",https://assets.publishing.service.gov.uk/media/5a74f1f240f0b6399b2af6f3/20151120-Shaat_Al_Arab_Learning_Account_Suplementary_Redacted.pdf
Value of extended Biffa contract with MOD for waste management services at UK RAF stations,https://assets.publishing.service.gov.uk/media/5a759f1340f0b67f59fce515/20151113-FOI08729-Revised.pdf
Number of armed forces officer graduates educated at state or independant schools 2010/11 to 2015/16,https://assets.publishing.service.gov.uk/media/5a74975840f0b616bcb17b99/20151124-FOI2015_09613-Education-REDACTED.pdf
Total spend by MOD on cars with police markings,https://assets.publishing.service.gov.uk/media/5a80be2840f0b62305b8ce51/20151127-FOI2015_09587_police_cars_spend_publish-O.pdf
Refurbishment cost of the launch point Control Caravans for the RAF's 25 Volunteer Gliding Squadrons and the RAF's Central Gliding School,https://assets.publishing.service.gov.uk/media/5a74e75040f0b65c0e8456b7/20151125-FOI-9862-Caravans-Cost-Redacted.pdf
"MOD Police corporate communications budget, internal house magazine costs, staff costs and headcount",https://assets.publishing.service.gov.uk/media/5a816f3fed915d74e62323f2/20151126_REDACTED_Reply_eCase_08292_RFI_119-15_Re_MDP_Corp_Comms.pdf
Attachment: MOD Police corporate services 2015,https://assets.publishing.service.gov.uk/media/5a7f9195ed915d74e33f73c8/20151126_Reply_attachment_eCase_08292_RFI_199-15_Re_MDP_Corp_Comms.pdf
Number of failed fitness tests by armed forces personnel (including reserves and territorial army) 2011 to 2015,https://assets.publishing.service.gov.uk/media/5a7f336540f0b6230268e0eb/20151123-FOI2015-09594.pdf
Number of sexual offences reported by members of the armed forces 2012 to 2015,https://assets.publishing.service.gov.uk/media/5a80e3cfe5274a2e8ab52bdb/20151130_FOI_09589-Number_of_SORN_and_Sexual_Offences.pdf
Year when servers were purchased and number of servers available for Defence Information Infrastructure (DII(F)),https://assets.publishing.service.gov.uk/media/5a7f573b40f0b62305b868d2/20151130-Redacted_DDC.pdf
"Details of the MOD Police's current HR (Human Resources), payroll and BACS software",https://assets.publishing.service.gov.uk/media/5a7f34b2e5274a2e87db470d/20151130-Redacted-08756.pdf
"Percentage of of black, asian and minority ethnic (BAME) army, Royal Navy and Royal Air Force officers",https://assets.publishing.service.gov.uk/media/5a8062a6e5274a2e87db9824/PUBLIC_1447950571_FOI_2015_09245.pdf
"MOD Police marine unit complement, purpose, number of launches and type of vehicles",https://assets.publishing.service.gov.uk/media/5a7ffb88e5274a2e87db7273/20151119-REDACTED_Reply_eCase_09920_RFI_23815_MDP_Marine_Unit_Complement.pdf
MOD DNA databases,https://assets.publishing.service.gov.uk/media/5a809e3040f0b623026948c1/20151120-FOI_09492_75923_DNA_Database_Final_Redacted-OS.pdf
RAF flying training pipelines and the 'Order of Battle' and number of applicants who applied for university sponsorship for pilot training 1 September 2014 to 31 March 2015,https://assets.publishing.service.gov.uk/media/5a81539e40f0b62305b8e59f/20150615-FOI-Flying-Training-UAS_Bursary-O.pdf
Daily messing rates for all UK armed forces personnel,https://assets.publishing.service.gov.uk/media/5a74beeae5274a3cb2866d80/FOI_Scan.pdf
Web domains owned or controlled by the MOD Police,https://assets.publishing.service.gov.uk/media/5a74d919e5274a59fa7156a3/20151123-REDACTED_Reply_eCase_09652_RFI_225-15_web_domains.pdf
"Number of armed forces personnel from Qatar, Saudia Arabia, UAE, Kuwait, Bahrain and Oman who graduated from RAF College Cranwell 2005 to 2015",https://assets.publishing.service.gov.uk/media/5a7f6106ed915d74e33f610f/20151112-FOI_2015_009670.pdf
"Number of Chinook pilots who left No. 18 and 27 Squadrons at their option point, on posting out or promotion 2012 to 2015",https://assets.publishing.service.gov.uk/media/5a80605eed915d74e33fa12e/20151120-FOI_2015_09406.pdf
"Royal Navy and Royal Marines appointments made at vice admiral, rear admiral and commodore level 1st January to 1st November 2015",https://assets.publishing.service.gov.uk/media/5a755699e5274a3cb2869a25/2015-09663_redacted_scanned.pdf
Copies of minutes of the Army Dress Committee 1 January 2015 to November 2015,https://assets.publishing.service.gov.uk/media/5a7f77df40f0b6230268fada/20151125-75925_response-O.pdf
"Attachment: Minutes of the 351st meeting of the Army Dress Committee, 26 March 2014",https://assets.publishing.service.gov.uk/media/5a80adb740f0b62305b8c880/20140605-Redacted-Mins-ADC-351.pdf
"Attachment: Minutes of the 352nd meeting of the Army Dress Committee, 26 March 2014",https://assets.publishing.service.gov.uk/media/5a801b4440f0b623026918dd/Mins_352nd_mtg_001-redacted.pdf
"Attachment: Minutes of the 353rd meeting of the Army Dress Committee, 26 March 2014",https://assets.publishing.service.gov.uk/media/5a7f3a8f40f0b6230268e39d/Mins_353rd_mtg_001-Redacted.pdf
"Copy of the Navy lists 2013, 2014 and 2015",https://assets.publishing.service.gov.uk/media/5a74ca5e40f0b61df477883f/2015-09490-Redacted.pdf
