title,pdf_link
Request of the Royal Guard Uniform manufacturer and the specific colour code for the red used in the uniform ,https://assets.publishing.service.gov.uk/media/5a7f267ce5274a2e87db419a/DE_S_F0I_2016-02897___Request_of_the_Royal_Guard_Uniform_manufacturer.pdf
Number staff employed by MOD for Saudi armed forces project (MODSAP) from 2008 to 2009,https://assets.publishing.service.gov.uk/media/5a803747e5274a2e87db8882/HOCS_F0I_2016-02168___Number_staff_employed_by_Ministry_of_Defence_for_Saudi_Armed_Forces_Project__MODSAP__from_2008_to_2009_annually_-_Clear.pdf
Request on government owned ships that go on sale or disposal recycling strategy,https://assets.publishing.service.gov.uk/media/5a8055e840f0b62302692e56/Request_on_government-owned_ships_that_go_on_sale_or_disposal_recycling_strategy.pdf
The number of homophobic hate crimes or motivated hate crimes recorded from the UK from 2013 to 2016,https://assets.publishing.service.gov.uk/media/5a8156a3ed915d74e6231b5f/MDP_FOI_2016_02900_RFI_83-16___The_number_of_homophobic_hate_crimes_or_motivated_hate_crimes_recorded_from_the_UK_from_2013_to_2016_-Create.pdf
The cost of policing demonstrations from far-right groups from 2014 to 2016,https://assets.publishing.service.gov.uk/media/5a7f0c8640f0b62305b84c06/MDP_FOI_2016_02590_RFI_78-16____The_cost_of_policing_demonstrations_from_far-right_groups__not_limited_from_2014_to_2016_-Create.pdf
Number of missing people incidents and “absent” people recorded on MOD Police command and control system each month from 2014 to 2016,https://assets.publishing.service.gov.uk/media/5a80616ded915d74e33fa197/MDP_FOI_2016_02072_RFI_62-16____The_number_of_missing_people_incidents_and__absent__pepole_recorded_on_command_and_control_system_each_month_from_2014_to_2016.pdf
DSRA RAMM 2015 expedition costs,https://assets.publishing.service.gov.uk/media/5a80d91fe5274a2e8ab5281a/HOCS_FOI_2016_02785____The_events_trip_cost_for_Defence_Sports_and_Recreational_Association__DSRA__in_2015.pdf
The number of UK armed forces personnel graded from H1 to H4 including noise induced hearing loss claims from 2011 to 2015,https://assets.publishing.service.gov.uk/media/5a81898de5274a2e8ab54849/Defence_Statistics_FOI_2016_02860____The_number_of_UK_Armed_Forces_personel_graded_from_H1_to_H4_including_noice_hearing_loose_claims_from_2011_to_2015.pdf
Details of individuals positions operating in fixed term appointments (FTA) within the Support Enablers Operating Centre (SEOC),https://assets.publishing.service.gov.uk/media/5a7f8c8be5274a2e87db684a/E_S_FOI_2016_01955___Request_for_details_of_individuals_positions_operating_in_FTA_inside_Support_Enablers_Operating_Centre__SEOC_.pdf
Number of Royal Navy personnel without a valid Royal Navy ID card and current security clearance,https://assets.publishing.service.gov.uk/media/5a8151aaed915d74e62319a2/FOI_2016-01827_Constable-redacted.pdf
Request for information between the CAA and MOD regarding NHT operating minima or risk assessments from 2012 to 2016,https://assets.publishing.service.gov.uk/media/5a748f9540f0b61938c7e706/DIO_FOI_2016_00495___Request_for_information_between_the_CAA_and_MOD_regarding_NHT_operating_minima_or_risk_assessments_from_2012_to_2016.pdf
Request of Combined Accommodation Assessment System (CAAS) band assessment information for the house building,https://assets.publishing.service.gov.uk/media/5a805b5fed915d74e33f9f5b/DIO_FOI_2016_01597___Request_of_Combined_Accommodation_Assessment_System__CAAS__band_assessment_information_for_the_house_building.pdf
Attachment: (CAAS) band assessment information of the house building record (Annex A),https://assets.publishing.service.gov.uk/media/5a74da78ed915d3c7d52875d/DIO_FOI_2016_01597_-_Attachment__CAAS__band_assessment_information_of_the_house_building_record__Annex_A_.pdf
Request information on Combined Accommodation Assessment System (CAAS) survey on BSIUD/UPRN,https://assets.publishing.service.gov.uk/media/5a756670e5274a1baf95e46a/DIO_FOI_2016_01758___Request_information_on_Combined_Accommodation_Assessment_System__CAAS__survey_on_BSIUD_UPRN_-_Clear.pdf
Attachment: CAAS assessment procedures BSIUD/UPRN (Annex A),https://assets.publishing.service.gov.uk/media/5a80e197e5274a2e8ab52b15/DIO_FOI_2016_01758___Attachment_CAAS_Assessment_Procedures_BSIUD_UPRN__Annex_A__Clear.pdf
Attachment: CAAS decent homes standard and condition (Annex A),https://assets.publishing.service.gov.uk/media/5a80cb2840f0b62305b8d2e5/DIO_FOI_2016_01758___Attachment_CAAS_Decent_homes_standard_and_condition__Annex_A__Clear.pdf
Attachment: Summary of CAAS challenge statistical analysis report February 2016 (Annex C) ,https://assets.publishing.service.gov.uk/media/5a80c86640f0b62305b8d1fc/DIO_FOI_2016_01758___Attachment_Summary_of_CAAS_challenge_Statistical_Analysis_report_February_2016__Annex_C_.pdf
Attachment: Energy survey data system rating criteria (Annex A),https://assets.publishing.service.gov.uk/media/5a7f93e340f0b62302690536/DIO_FOI_2016_01758___Attachment_energy_survey_data_system_rating_criteria__Annex_A_.pdf
Attachment: CAAS health and safety rating system (HHSRS) survey data (Annex A),https://assets.publishing.service.gov.uk/media/5a800d38ed915d74e622c2f2/DIO_FOI_2016_01758___Attachment_CAAS_Health_and_Safety_Rating_System__HHSRS__survey_data__Annex_A__Clear.pdf
Attachment: Map of CAAS (Annex B),https://assets.publishing.service.gov.uk/media/5a7f8379e5274a2e87db64df/DIO_FOI_2016_01758___Attachment_map_of_CAAS__Annex_B__Clear.pdf
Attachment: CAAS challenge statistical analysis estate breakdown (Annex C),https://assets.publishing.service.gov.uk/media/5a7f4d12ed915d74e6229a03/DIO_FOI_2016_01758___Attachment_CAAS_Challenge_statistical_analysis_Estate_breakdown__Annex_C__Clear.pdf
Attachment: CAAS challenge statistical analysis created and close flight path from 2015 to 2016 (Annex C),https://assets.publishing.service.gov.uk/media/5a80b9a5e5274a2e8ab51ce1/DIO_FOI_2016_01758___Attachment_CAAS_Challenge_statistical_analysis_Created_and_Close_Flight_Path_from_2015_to_2016__Annex_C__Clear.pdf
Attachment: CAAS challenge statistical analysis owner in CAAS of OST HSM (Annex C),https://assets.publishing.service.gov.uk/media/5a75be2ced915d506ee8127c/DIO_FOI_2016_01758___Attachment_CAAS_Challenge_statistical_analysis__DIO__owner_in_CAAS_of_OST_HSM__Annex_C__Clear.pdf
Attachment: CAAS challenge statistical analysis regional creation breakdown (Annex C),https://assets.publishing.service.gov.uk/media/5a803db6e5274a2e87db8ad6/DIO_FOI_2016_01758___Attachment_CAAS_Challenge_statistical_analysis_regional_creation_breakdown__Annex_C__Clear.pdf
Number of RAF Halton apprentices still serving,https://assets.publishing.service.gov.uk/media/5a8174a440f0b6230269766a/20160301-RAF-Halton-Apprentices-O.pdf
Request for documents about air traffic management and radar analysis,https://assets.publishing.service.gov.uk/media/5a7f87e7e5274a2e87db667b/20160203-UK_Air_Defence_Procedures.pdf
Status of HMS Endurance,https://assets.publishing.service.gov.uk/media/5a816289e5274a2e8ab53b4b/2016-01790_redacted_scanned.pdf
"Places visited whilst serving on HMS Gloucester, Cardiff, Leeds Castle and Nottingham",https://assets.publishing.service.gov.uk/media/5a7f253a40f0b6230268db6a/2016-02090_redacted_scanned.pdf
Request for DCI Gen 263/92 and Command Paper 2050 as presented to the U.K. Parliament on 20 Aug 1992,https://assets.publishing.service.gov.uk/media/5a8183b1e5274a2e87dbe09d/20160304-FOI2016-01733_Response_REDACTED.pdf
Attachment: Defence Council Instruction (DCI GEN 263/92),https://assets.publishing.service.gov.uk/media/5a7f9ff1ed915d74e33f790f/19920103-DCI_GEN_263.pdf
"Attachment: Command Paper 2050: The General Service Medal, 1962",https://assets.publishing.service.gov.uk/media/5a802779ed915d74e33f8c3d/Command_Paper_2050.pdf
"Full details of the remuneration package for Tony Douglas, Chief Executive of Defence Equipment and Support (DE&S)",https://assets.publishing.service.gov.uk/media/5a80d07ded915d74e623098b/20160216-FOI2016_01675_DES_CE_Pay_Package-redacted.pdf
Stock numbers of all types of land rovers for available at MOD disposal sites,https://assets.publishing.service.gov.uk/media/5a80524340f0b62302692d07/FOI2016-01251.pdf
Number of ACF officers over the age of 69 in the UK,https://assets.publishing.service.gov.uk/media/5a8153aae5274a2e87dbd049/20160224-FOI01339_Redacted__2_.pdf
Breakdown of money spent on bonuses in MDP from 2012/13 to 2015/16,https://assets.publishing.service.gov.uk/media/5a7f3c6ee5274a2e87db4a02/20160226_-_REDACTED_Reply_to_eCase_01521_RFI_4516_Re_Police_Expenses.pdf
Request for several documents relating to overpayment of flying pay (RRP(F)),https://assets.publishing.service.gov.uk/media/5a7f454ae5274a2e8ab4b293/20160202-FOI_RRP_F__generic_response.pdf
Attachment: Defence internal audit report: army - controls over the payment of flying pay (RRP(F)),https://assets.publishing.service.gov.uk/media/5a7f7eafed915d74e33f6c8c/20151113_DIA_Report_RRP_F__Final_dated_Jul_13_Redacted.pdf
Attachment: The pay warrant 1964 Army Code no 14173,https://assets.publishing.service.gov.uk/media/5a7f461140f0b6230268e810/1058_Army_Pay_Warrant_Redacted.pdf
Attachment: CDP DG Fin (DBS/SPV/CE/06/14) letter dated 18 June 2014 ref overpayment of recruiting and retention pay (flying) (RRP(F)) to army pilots,https://assets.publishing.service.gov.uk/media/5a802d05e5274a2e87db84b6/20140618_CDP_DG_Fin.pdf
"Attachment: DG Pers letter to CE SPVA dated 20 September 2013, ref overpayment of recruiting and retention pay (flying) (RRP(F)) to army pilots",https://assets.publishing.service.gov.uk/media/5a7f8da9e5274a2e87db68b8/20130920-RRP_F__Overpayment_Cover_Letter-R-DG_PERS_to_CE_SPV.pdf
Attachment: DG Pers covering letter to CE SPVA recomending write-off RRP(F) dated September 2013 including enclosures,https://assets.publishing.service.gov.uk/media/5a8018e5e5274a2e87db7d5d/DG_Pers_covering_letter_to_CE_SPVA_recomending_write-off_RRP_F__dated_September_2013.pdf
"Attachment: Flying pay, transition from pilot to aircraft commander",https://assets.publishing.service.gov.uk/media/5a75c63040f0b67f59fcf82b/20020121-Flying_Pay_Transition_from_Pilot_to_Ac-Comd-HQ_DAAv.pdf
Attachment: HQ DAAvn 2007 Letter FO transition to P1 Pilot Status 1 March 2007 with Annexes A and B,https://assets.publishing.service.gov.uk/media/5a7f6f5540f0b62305b87207/20070301-HQ_DAAvn_FP_Transition_to_P1_Pilot_Status_1_Mar_200.pdf
Attachment: HQ AAC letter to AG recommending write-off of RRP(F) dated April 2013,https://assets.publishing.service.gov.uk/media/5a74e202ed915d3c7d528b01/20130326_RRP_F__Overpayment_Case_WriteOff_Ltr_to_AG_draftV2_.pdf
Update on AAC RRP(F) issue as at 7 June 2013,https://assets.publishing.service.gov.uk/media/5a7f4fd0ed915d74e33f5a80/20130607-Regt_Col-RRP_F_-_SITREP-Jun13_redacted.pdf
"Attachment: AAC letter, commencement of flying pay dated 29 January 2003",https://assets.publishing.service.gov.uk/media/5a80e39f40f0b62305b8db77/Commencement_of_flying_pay_DCOS_DAAvn_letter_2003_redacted.pdf
Attachment: Regimental Col AAC open letter to the corps on overpayment of flying pay dated February 2012,https://assets.publishing.service.gov.uk/media/5a7f6781ed915d74e622a402/Regtl_Col_Letter_To_Pilots_Feb_2012_Redacted.pdf
Attachment: Transfer of pilot from army to RAF correspondence dated 28 October 2013,https://assets.publishing.service.gov.uk/media/5a806b11ed915d74e33fa509/20131028_RRP_F__Start_Date_-_Transfer_from_Army_to_RAF_Redac.pdf
Attachment: DDSPS note on regulations for flying pay 2001,https://assets.publishing.service.gov.uk/media/5a7557aa40f0b6360e4735b6/20151103_DDSPS_A_166RA_Dated__14_Sep_01_2.pdf
Attachment: HQ DAAvn letter on SP(F) Harmonisation dated 13 March 2008,https://assets.publishing.service.gov.uk/media/5a80d139ed915d74e33fc93f/20151103_SP_F__Harmonisation_HQ_DAAvn_Letter_dated_13_Mar_08.pdf
Attachment: Army pay warrant amendment dated October 2005,https://assets.publishing.service.gov.uk/media/5a804c5540f0b62302692ad1/20151103_Army_Pay_Warrant_Amend_75_Dtd_Oct_05.pdf
"Attachment: Flying pay, transition from P2 pilot to P1 aircraft commander status",https://assets.publishing.service.gov.uk/media/5a80b189e5274a2e87dbb49d/20070124-Flying_Pay_Transition_to_Aircraft_Commander_Status_.pdf
Attachment: Decision on application of RRP(F) from CTT completion dated 5 June 2013,https://assets.publishing.service.gov.uk/media/5a80c72440f0b62305b8d188/20130605_Commencement_Of_RRP_F__On_Completion_Of_CTT-PS10_A_.pdf
"Attachment: Annex B dated 18 February 2008, Chapter 6, Section 17 specialist pay (flying)",https://assets.publishing.service.gov.uk/media/5a815c7c40f0b62305b8e894/20080218-SP_F__Harmonisation-Annex_B-PS10_A__No_redactions-R.pdf
Attachment: Estoppel legal consideration note to CE SPVA dated 12 August 2013,https://assets.publishing.service.gov.uk/media/5a80e73e40f0b62305b8dcc4/20130812_HQ_AAC_Estoppel_Legal_Consideration_Note_to_CE_SPVA.pdf
Attachment: Estoppel legal consideration note to AD Legal dated 8 August 2014,https://assets.publishing.service.gov.uk/media/5a80cceee5274a2e8ab523cf/20130808_HQ_AAC_Estoppel_argument_for_write_off_of_GPD-Legal.pdf
Attachment: Correspondence dated 5 June 2015 regarding recovery of overpayment of RRP(F) ,https://assets.publishing.service.gov.uk/media/5a8023f7e5274a2e8ab4e6ab/20151204-20150605-RRP_F_-RECOVERY-CAAC_OS_-_Letter_to_SPS_FC.pdf
Attachment: Evolution of army flying pay from mid-80s to present day,https://assets.publishing.service.gov.uk/media/5a80d1f340f0b62305b8d545/20130820-History_of_Army_RRP_F__Redacted.pdf
Attachment: Correspondence dated 21 October 2015 regarding recovery of overpayment of RRP(F) to army pilots,https://assets.publishing.service.gov.uk/media/5a7f9f5c40f0b62305b88454/20151021-AAC_RRP_F__Overpayments_RAO_Direction_OS_Redacted.pdf
Attachment: VCDS letter dated 29 May 2014: Overpayment of recruiting and retention pay (flying) (RRP(F)),https://assets.publishing.service.gov.uk/media/5a7f8226e5274a2e8ab4c993/20140527-VCDS_RRPF_Overpayment_Note-OS-MADGPers-29_May_14Red.pdf
Attachment: Aviation crewman specialist pay letter dated 4 April 2007,https://assets.publishing.service.gov.uk/media/5a7f60ceed915d74e33f60f7/20070404-Aviation_Crewman_Spec_Pay_Redacted.pdf
Attachment: Submission of service complaint in relation to flying pay dated 18 March 2010,https://assets.publishing.service.gov.uk/media/5a81a5e2ed915d74e6233657/20100318-LM_on_Flying_Pay_Service_Compaint-PS10_A__Redacted.pdf
Attachment: Recruiting and retention pay (flying) (RRP(F)) situation report,https://assets.publishing.service.gov.uk/media/5a814b4aed915d74e33fd6a6/20121017_SP_F__SITREP_to_DAAvn_Redacted.pdf
Harmonisation of specialist pay (flying) letter dated 6 September 2007,https://assets.publishing.service.gov.uk/media/5a80b79040f0b623026951b7/20070906-SP_F__Harmonisation_HQ_DAAvn_Redacted.pdf
Request a copy of the Final Tender Assessment Panel report on Future Logistic Information Services (FLIS) contract,https://assets.publishing.service.gov.uk/media/5a80ed9940f0b62305b8df0c/FOI2016-01329.pdf
"Attachment: Future Logistic Information Services (FLIS) Project, main gate supporting papers, Bid evaulation: management report",https://assets.publishing.service.gov.uk/media/5a7f1199e5274a2e87db399f/FLIS_Bid_Evaluation_2016-01329.pdf
Request a copy of Board of Inquiry: accident involving Typhoon ZJ943 at China Lake on 23 April 2008,https://assets.publishing.service.gov.uk/media/5a814de5e5274a2e87dbce4a/20160302-FOI-2016-02374__2_.pdf
Attachment: Board of Inquiry: accident involving Typhoon ZJ943 at China Lake on 23 April 2008,https://assets.publishing.service.gov.uk/media/5a7f2898e5274a2e87db4261/20160301-Typhoon_ZJ943_BOI-final.pdf
Request for minutes of meetings of the Army Dress Committee (ADC) and technical specification documents,https://assets.publishing.service.gov.uk/media/5a8057e5ed915d74e622de82/20160226-FOI11871_Respone-O.pdf
"Attachment: Technical specification for insignia, buttons pins and titles manufactured from gliding metal, brass and nickel silver (Issue 13)",https://assets.publishing.service.gov.uk/media/5a74b640e5274a3f93b482fb/20140108-UKSC_5126_Iss_13-U.PDF
"Attachment: Technical specification for insignia, buttons pins and titles manufactured from gliding metal, brass and nickel silver (Issue 12)",https://assets.publishing.service.gov.uk/media/5a80749ced915d74e622e8d5/20131210-UKSC_5126_Iss_12-U.PDF
"Attachment: Technical specification for insignia, buttons pins and titles manufactured from gliding metal, brass and nickel silver (Issue 10)",https://assets.publishing.service.gov.uk/media/5a7f7e48ed915d74e33f6c67/20120828-UKSC_5126_Iss_10-U.PDF
"Attachment: Minutes of the 341st meeting of the Army Dress Committee, 18 November 2009",https://assets.publishing.service.gov.uk/media/5a7f8d46ed915d74e622b284/20091208-ADC_341-O.pdf
"Attachment: Minutes of the 323rd meeting of the Army Dress Committee, 24 October 2005",https://assets.publishing.service.gov.uk/media/5a80beb1e5274a2e87dbb930/20051111-ADC_323-O.pdf
Request for a copy of Transfer undertakings protection employment (TUPE) details for the Air Traffic Management services contract at Wattisham,https://assets.publishing.service.gov.uk/media/5a805942ed915d74e33f9e94/20160224-FOI01330_Redacted.pdf
Attachment: Transfer undertakings protection employment (TUPE) details for the Air Traffic Management services contract at Wattisham,https://assets.publishing.service.gov.uk/media/5a808d4b40f0b623026942c6/20160224-CS5D_TUPE_Employee_Spreadsheet-U_REDACTED.pdf
Various questions relating to Regional Chairman posts within the Air Cadet Organisation,https://assets.publishing.service.gov.uk/media/5a74df7ced915d502d6cbacb/20160301-FOI-ACO-Civilian-Pillar_Governance-O.pdf
Number of honorary members of the armed forces (civilians granted a commissioned (officer) rank),https://assets.publishing.service.gov.uk/media/5a803607e5274a2e8ab4ed4e/FOI2016_01737.pdf
Information on the Type 23 power generation and machinery unit (PGMU) contract,https://assets.publishing.service.gov.uk/media/5a804ddeed915d74e33f9a77/FOI2016-00121.pdf
Details of the armed forces redundancy packages in force for officers in the RAF from 1998 to 2015,https://assets.publishing.service.gov.uk/media/5a80e0d3ed915d74e33fcec4/Red_FOI2016_01772.pdf
"Attachment: Retirement, resignation, transfer to the reserve and relinquishment of commission, etc – officers (Queen’s Regulations: Chapter 38)",https://assets.publishing.service.gov.uk/media/5a7f664eed915d74e622a393/QRS_ch38.pdf
"Attachment: Service pensions, service invaliding pensions, service attributable pensions, terminal grants and gratuities – airmen (Queen’s Regulations: Chapter 39)",https://assets.publishing.service.gov.uk/media/5a800774e5274a2e87db76cb/QRs_ch39.pdf
 Attachment: Preserved benefits: officers and airmen resettlement grants (Queen’s Regulations: Chapter 40),https://assets.publishing.service.gov.uk/media/5a818cc6e5274a2e87dbe39f/QRs_ch40.pdf
"Attachment: Family pensions and gratuities to surviving spouses, surviving civil partners, surviving eligible partners and children of officers and airmen (Queen’s Regulations: Chapter 41)",https://assets.publishing.service.gov.uk/media/5a7f9bce40f0b62305b882ed/QRs_ch41.pdf
"Attachment: Half-pay, retired pay and payment of pensions (Queen’s Regulations: Chapter 42)",https://assets.publishing.service.gov.uk/media/5a802420ed915d74e622cb59/QRs_ch42.pdf
Attachment: Pensions increase (Queen’s Regulations: Chapter 43),https://assets.publishing.service.gov.uk/media/5a7f1360e5274a2e8ab49f5d/QRs_ch43.pdf
Attachment: Redundancy - compensation terms (Queen’s Regulations: Chapter 44),https://assets.publishing.service.gov.uk/media/5a8088dae5274a2e8ab50b27/QRs_Chapter_44.pdf
Number of reported cases of UFO or paranormal incidences,https://assets.publishing.service.gov.uk/media/5a7f6eaf40f0b6230268f76f/20160303_Reply_to_eCase_01713_RFI_50-16_Re_Cost_of_investigating_paranormal_activity.pdf
Details of fuel hedging and procurement,https://assets.publishing.service.gov.uk/media/5a7f8c7ded915d74e33f71e0/FOI2016-01249_-_Fuel_Hedging_and_procurement.pdf
MOD Summer and Autumn Budget figures 2015/16,https://assets.publishing.service.gov.uk/media/5a814e4eed915d74e6231874/FOI2016-01523_-_MOD_Summer_and_Autumn_Budget_Figures.pdf
Costs of training Libyan troops at Bassingbourn Barracks,https://assets.publishing.service.gov.uk/media/5a7f6793e5274a2e8ab4bfab/FOI2016-01770_-_Costs_for_training_Libyan_troops_at_Bassingbourn_Barracks.pdf
Details of MOD financial accounting software,https://assets.publishing.service.gov.uk/media/5a74f57740f0b6360e47238d/FOI2016-01892_-_MOD_financial_accounting_software.pdf
Copy of the Defence Internal Audit report: HOCS - MDP capability handling and management sickness,https://assets.publishing.service.gov.uk/media/5a8021f240f0b62305b89601/FOI2016-02034_-_HOCS_MDP_Capability_Handling_Sickness_Management_Report.pdf
Damage to MOD property at Bassingbourn Barracks,https://assets.publishing.service.gov.uk/media/5a7f33f540f0b6230268e123/FOI2015-04144_Damage_to_MOD_property_at_Bassingbourn_Barracks.pdf
The current status of Tornado GR1 airframes (serial numbers ZA409 and ZA474),https://assets.publishing.service.gov.uk/media/5a816e05ed915d74e6232385/FOI2016_01747_The_current_status_of_Tornado_GR1_airframes.pdf
Number of nuclear safety events recorded by the Nuclear Propulsion Project Team at HMNB Devonport from 2010 to 2015,https://assets.publishing.service.gov.uk/media/5a7f497ded915d74e33f57fe/FOI2015_09090.pdf
Request for army policy on empoying recruits with unspent criminal convictions,https://assets.publishing.service.gov.uk/media/5a80ebb9ed915d74e33fd284/20160226-FOI01401_76472-Redacted.pdf
"Attachment: Policy for the recruitment and enlistment/commissioning of personnel with criminal convictions (Army General Administrative Instructions: Volume 2, Chapter 41) ",https://assets.publishing.service.gov.uk/media/5a7f42ce40f0b6230268e6c1/20160219-FOI01401_76472_Recruitment_Policy_Convictions_OS-Policy.pdf
Number of medically discharged veterans in West Cumbria ,https://assets.publishing.service.gov.uk/media/5a758129e5274a1242c9ed62/FOI2016_01967_Redacted.pdf
Request for report into cancellation of Gibraltar summer camp,https://assets.publishing.service.gov.uk/media/5a747a51ed915d0e8e398834/20160301-FOI-ACO-Gibraltar-Summer-Camp-O.pdf
Attachment: Investigation in to the circumstances of the cancellation of an expedition to Gibraltar,https://assets.publishing.service.gov.uk/media/5a80b39040f0b62305b8ca92/20160301-FOI-ACO-Gibraltar_Summer-Camp-Attachment-O.pdf
Number of crimes and bullying incidents reported at the HMNB Clyde annually from 2013 to 2016,https://assets.publishing.service.gov.uk/media/5a80d91240f0b62305b8d7ca/20160226_REDACTED_Reply_letter_to_eCase_00862_RFI_38-16_Re_Crimes_and_bullying_at_HMNB_Clyde.pdf
Number of officers or ratings discharged from the Royal Navy following citizenship issues,https://assets.publishing.service.gov.uk/media/5a81715740f0b62305b8efac/FOI_2016-01826_-_Redacted.pdf
Number of unsolved and recorded crimes in each county in England from 1 January 2015 to 31 December 2015,https://assets.publishing.service.gov.uk/media/5a7f5a2de5274a2e8ab4ba8c/20160301_-_REDACTED_Reply_to__eCase_02028__RFI_58-16_Re_Total_number_of_unsolved_recorded_crimes_and_Number_of_MDP_on_a_county_by_county_basis.pdf
"Number of police vehicles involved in traffic collisions from financial years 2012/13, 2013/14, and 2014/15",https://assets.publishing.service.gov.uk/media/5a80b871e5274a2e8ab51c78/20160301_-_REDACTED_Reply_to_eCase_00174_RFI_0916_Re_Details_of_police_vehicles_involved_in_traffic_collisions.pdf
Information on homelessness policy for veterans,https://assets.publishing.service.gov.uk/media/5a80c54b40f0b62302695685/20160222-_FOI_2016-01412_Redacted.pdf
Request for copies of all information on the conduct of job evaluation process for the Royal Military Police and Royal Air Force Police,https://assets.publishing.service.gov.uk/media/5a80d8c2ed915d74e33fcbf3/20160223_FOI2016_01009_REDACTED.pdf
Attachment: Annex A to FOI2016/01009,https://assets.publishing.service.gov.uk/media/5a804ebd40f0b62302692bb7/Annex_A_to_FOI_01009_-_RMP-RAFP.pdf
"Attachment: Factor plan 1999, job evaluation for the armed forces",https://assets.publishing.service.gov.uk/media/5a7f69dded915d74e622a4ed/Factor_Plan_1999.pdf
Attachment: Job analysis questionnaire,https://assets.publishing.service.gov.uk/media/5a7f5d65ed915d74e33f5fb1/Job_Analysis_Questionnaire.pdf
Attachment: Guidance notes to questionnaire,https://assets.publishing.service.gov.uk/media/5a805c0ce5274a2e8ab4fb30/Guidance_Notes_to_Questionnaire.pdf
Attachment: Job evaluation explained,https://assets.publishing.service.gov.uk/media/5a8176f1ed915d74e6232693/Job_Evaluation_Explained.pdf
Cost to MOD and related departments for Newspaper Licensing Agency (NLA) or Copyright Licensing Agency (CLA) media licence 2013 to 2014 ,https://assets.publishing.service.gov.uk/media/5a817c1bed915d74e623284b/FOI201601719_Redacted.pdf
Information on the amount spent by the MOD on external recruitment agencies and headhunters,https://assets.publishing.service.gov.uk/media/5a81b82c40f0b62302698d1e/Re_FOI2016_01073.pdf
No approval of satanism or luciferianism as a religion has been issued by the Royal Navy,https://assets.publishing.service.gov.uk/media/5a7fa312ed915d74e33f7a52/20160222_-_2015-11679_Redacted.pdf
Information on who owns the pipelines and who has permission to remove the pipelines,https://assets.publishing.service.gov.uk/media/5a805aa6e5274a2e87db9564/20160216-FOI00783.pdf
Policy for management of individuals who are diagnosed with Hepatitis C whilst serving,https://assets.publishing.service.gov.uk/media/5a80823aed915d74e33fad5c/20160216_FOI01247_Hepatitis_policy.pdf
Information on the status of a patch of land at the former Chatham Dockyard which now sites the new ASDA Superstore,https://assets.publishing.service.gov.uk/media/5a80087e40f0b623026911b2/20160204-FOI00845.pdf
