title,pdf_link
Request for Army Equipment Support Publication (AESP) repairs document for Alvis Shielder armoured vehicle,https://assets.publishing.service.gov.uk/media/5a82cf52e5274a2e87dc3178/Request_for_AESP_repair_manual_for_Alvis_Shielder_armoured_vehicle.pdf
Secondment for civilian and military personnel and the policy criteria,https://assets.publishing.service.gov.uk/media/5a81fad340f0b6230269a31e/Secondment_for_civilian_and_military_personnel_and_the_policy_criteria.pdf
"Contractor not yet appointed for the new office building at Admiralty Way, Somerset",https://assets.publishing.service.gov.uk/media/5a82e27340f0b6230269d35e/Contractor_not_yet_appointed_for_the_new_office_building_at_Admiralty_Way__Somerset.pdf
 Ministry of Defence Police (MDP) report of bribery on public and private sector personnel,https://assets.publishing.service.gov.uk/media/5a82eb1be5274a2e8ab5a033/Ministry_of_Defence_Police__MDP_report_of_bribery_on_public_and_private_sector_personnel.pdf
Ministry of Defence (MOD) awarded contract to CarillionAmey for refurbishment at RAF Digby,https://assets.publishing.service.gov.uk/media/5a81f64d40f0b6230269a190/Ministry_of_Defence__MOD__awarded_contract_to_CarillionAmey_for_refurbishment_at_RAF_Digby.pdf
Report on the number of military homes in Hampshire awaiting repairs,https://assets.publishing.service.gov.uk/media/5a74d9fded915d3c7d52871b/Report_on_the_number_of_military_homes_in_Hampshire_awaiting_repairs.pdf
UK firing range overseen by qualified range conducting officer,https://assets.publishing.service.gov.uk/media/5a81ebfeed915d74e3400c73/UK_firing_range_overseen_by_qualified_range_conducting_officer.pdf
"Information on repairs carried out on the Globe Theatre, grade 2 listed building in Plymouth between 2015 to 2016",https://assets.publishing.service.gov.uk/media/5a74ec6240f0b65c0e84597f/Information_on_repairs_carried_out_on_the_Globe_Theatre__grade_11_listed_building_in_Plymouth_between_2015_to_2016.pdf
Number of vehicles purchased under NATO Stock Number (NSN) 2320999085631,https://assets.publishing.service.gov.uk/media/5a74dfa5e5274a3cb2867def/Number_of_vehicles_purchased_under_NSN_2320999085631.pdf
Ministry of Defence police (MDP) negligent discharge of firearms from 2014 to 2016,https://assets.publishing.service.gov.uk/media/5a8210c4ed915d74e340189a/Ministry_of_Defence_police__MDP__negligent_discharge_of_firearms_from_2014_to_2016.pdf
Defence Infrastructure Organisation (DIO) terms and condition for construction framework,https://assets.publishing.service.gov.uk/media/5a82f309ed915d74e6238716/Defence_Infrastructure_Organisation__DIO_terms_and_condition_for_construction_framework.pdf
Defence and National Rehabilitation Centre: Stanford Hall building project due for transfer to Ministry of Defence (MOD) in 2018,https://assets.publishing.service.gov.uk/media/5a82bddded915d74e3403553/Defence_and_National_Rehabilitation_Centre_-_Stanford_Hall_building_project_due_for_transfer_to_Ministry_of_Defence__MOD__in_2018.pdf
Detail of hunt meetings on the Salisbury Plain from November to December 2016,https://assets.publishing.service.gov.uk/media/5a8201ac40f0b6230269a566/Detail_of_hunt_meetings_on_Salisbury_Plain_from_November_16_to_December_16.pdf
Information on Ministry of Defence Police (MDP) instant messaging capability,https://assets.publishing.service.gov.uk/media/5a81c5cbed915d74e33fffb3/Information_on_Ministry_of_Defence_police__MDP_instant_messaging_capability.pdf
Statistics on the armed forces recruits training failure at stage one from 2010 to 2016 ,https://assets.publishing.service.gov.uk/media/5a8221c4e5274a2e87dc14f0/Statistics_on_the_armed_forces_recruits_training_failure_at_stage_one_from_2010-2016.pdf
Number of service personnel failure on compulsory drug testing from 2015 to 2016,https://assets.publishing.service.gov.uk/media/5a81e37140f0b62302699b55/Number_of_service_personnel_failure_on_compulsory_drug_testing_from_2015-2016.pdf
Cost to MOD for service personnel in receipt of continuity education allowance since 2012 to 2016,https://assets.publishing.service.gov.uk/media/5a8225bbed915d74e6236093/Cost_to_Ministry_of_Defence__MoD__for_Service_personnel_in_receipt_of_continuity_education_allowance_since_2012-2016.pdf
 Number of regular recruits who completed phase one training from 2011 to 2016,https://assets.publishing.service.gov.uk/media/5a81d585ed915d74e62345d6/Number_of__regular_recruits_completed_phase_1_training_from_2011-2016.pdf
Eligibility for events occurring during Armed Forces Day 2016,https://assets.publishing.service.gov.uk/media/5a82b19e40f0b6230269c364/Eligibility_for_events_occurring_during_Armed_Force_day_2016.pdf
Use of Saudi Liberation of Kuwait Medal and the Kuwaiti Liberation medal,https://assets.publishing.service.gov.uk/media/5a82beb6ed915d74e340359c/Defence_Council_Instruction__DCI__on_medal_criteria_and_awards.pdf
 National Crime Agency (NCA) partnership with Career Transition Partnership (CTP) employment programme explained,https://assets.publishing.service.gov.uk/media/5a822522ed915d74e6236062/National_Crime_Agency__NCA__partnership_with_Career_Transition_Partnership__CTP__employment_programme_explained_under_Section_23_of_the_FOI.pdf
Number of vehicles the Disposal Service Agency sold to contractor L Jackson & Co (UK) from 2011 to 2016,https://assets.publishing.service.gov.uk/media/5a82ba2de5274a2e87dc2adc/number_of_vehicles_the__Disposal_Service_Agency_sold_to_contractor_L_Jackson_Co_UK_from_2011-2016.pdf
Number of unused freehold properties in England owned by the Ministry of Defence (MOD),https://assets.publishing.service.gov.uk/media/5a82dd3de5274a2e8ab59bc9/Number_of_unused_freehold_properties_in_England_owned_by_the_Ministry_of_Defence__MoD_..pdf
Inspection report on the repair cost of the Frodsham building,https://assets.publishing.service.gov.uk/media/5a829d9ded915d74e3402aed/Inspection_report_on_the_repair_cost_of_the_Frodsham_building.pdf
Repair charges for service family accommodation (SFA) under Private Finance initiative (PFI),https://assets.publishing.service.gov.uk/media/5a74837de5274a7f9c58696a/Report_on_repair_charges_for_service_family_accommodation_under_Private_Finance_initiative.pdf
Northern Ireland Pan Geographical classification travelling times,https://assets.publishing.service.gov.uk/media/5a81fab340f0b62305b91d53/Norther_Ireland_Pan_Geographical_classification_travelling_times.pdf
Report on the future plan for RAF Halton following closure in 2022,https://assets.publishing.service.gov.uk/media/5a81c16ae5274a2e87dbf4e5/Report_on_the_future_plan_for_RAF_Halton_following_closure_in_2022.pdf
Information on the number of aircraft from North Yorkshire airbase intercepted Russian military aircraft from 2015 to 2016 ,https://assets.publishing.service.gov.uk/media/5a821fb1e5274a2e8ab579e0/Information_on_the_number_of_aircraft_from_North_Yorkshire_airbase_intercepted_Russian_military_aircraft_from_2015-2016.pdf
Request copy of chapter 3 of the Army Equipment Support Publication (AESP) 2320-D-122-711,https://assets.publishing.service.gov.uk/media/5a82a52be5274a2e87dc2402/Chapter_3_of_the_Army_Equipment_Support_Document_2320-D-122-711.pdf
Ministry of Defence Police (MDP) report on witness attendance at disciplinary hearings from 2015 to 2017,https://assets.publishing.service.gov.uk/media/5a820d21e5274a2e87dc0e42/Ministry_of_Defence_Police__MDP_report_on_witness_attendance_at_disciplinary_hearings_from_2015-2017.pdf
"Report on liability payments in excess of £30,000 paid by the Ministry of Defence (MOD) for goods and services from 2013 to 2016",https://assets.publishing.service.gov.uk/media/5a81ccc2e5274a2e87dbf8b7/Report_on_liability_payments_in_exccess_of__30_000_paid_by_the_Ministry_of_Defence__MOD__for_goods_and_services_from_2013-2016.pdf
Report on the amount of recyling berylium material used in the Herald Research Reactor,https://assets.publishing.service.gov.uk/media/5a81c256e5274a2e87dbf528/Report_on_the_amount_of_recyling_berylium_material_used_in_the_HERALD_research_reactor.pdf
Request copy of Army Equipment Support Publication (AESP) 233-E202-522 GS cargo,https://assets.publishing.service.gov.uk/media/5a824608e5274a2e8ab586a5/Army_Equipment_Support_Publication__AESP__233-E202-522_GS_Cargo.pdf
Drug test results in the armed forces from 2012 to 2016,https://assets.publishing.service.gov.uk/media/5a81c167e5274a2e8ab55a69/Report_on_the_drug_test_result_in_the_armed_forces_during_the_period_2012-2016.pdf
Request for Army Briefing Notes (ABN) 156/16 and 165/16  ,https://assets.publishing.service.gov.uk/media/5a74c983ed915d3c7d527f5a/Request_for_Army_Briefing_Notes__ABN__156-16_and_165-16.pdf
Number of graded properties for service families in UK and Northern Ireland at tier 4 and below ,https://assets.publishing.service.gov.uk/media/5a74bbb1ed915d502d6ca8d7/Report_on_the_number_of_graded_properties_for_service_families_in_UK_and_Northern_Ireland_at_tier_4_and_below.pdf
Legal approval granted to erect a bund  at the Town Green in Kent,https://assets.publishing.service.gov.uk/media/5a822477ed915d74e3401f47/Legal_approval_granted_to_erect_a_bund__at_the_Town_Green_in_Kent.pdf
Purchase of listed buildings Shandon House and South lodge by the MOD ,https://assets.publishing.service.gov.uk/media/5a81ca21ed915d74e62341fb/Purchase_of_listed_buildings_Shandon_House_and_South_lodge_by_the_Ministry_of_Defence__MOD_.pdf
Number of Royal Navy helicopters ditched in 1975,https://assets.publishing.service.gov.uk/media/5a7501f640f0b6360e4729b4/Report_on_the_number_of_Royal_Navy_helicopters_ditched_in_1975.pdf
Number of people prosecuted for drink driving offences by the Ministry of Defence police (MDP) from 2013 to 2017,https://assets.publishing.service.gov.uk/media/5a82c7c240f0b62305b944ed/Report_on_the_number_of_people_prosecuted_for_drink_driving_offences_by_the_Ministry_of_Defence_police__MDP__from_2013-17.pdf
Report on the possible sale of Ministry of Defence (MOD) estate in Leicester for housing development,https://assets.publishing.service.gov.uk/media/5a81c810ed915d74e6234149/Report_on_the_possible_sale_of_Ministry__of_Defence__MOD__estate_in_Leicester_for_housing_development.pdf
Information data on the entire fleet of the Royal Air Force (RAF) aircrafts,https://assets.publishing.service.gov.uk/media/5a81f342e5274a2e87dc0598/Information_data_on_the_entire_fleet_of_the_Royal_Air_Force__RAF__aircrafts.pdf
Statistics on Royal Navy Engineer officers and ratings from 2011 to 2016,https://assets.publishing.service.gov.uk/media/5a829f25ed915d74e6236c68/Statistics_on_Royal_Navy_engineer_officers_and_ratings_from_2011-2016.pdf
Statistics on the number of Royal Navy and Royal Marines  officers and ratings completed their length of service,https://assets.publishing.service.gov.uk/media/5a82381340f0b6230269b795/Statistics_on_the_number_of_Royal_Navy_and_Royal_Marines__officers_and_ratings_completed_their_length_of_service.pdf
Statistics on new entrant QARNNS officers,https://assets.publishing.service.gov.uk/media/5a82013940f0b62305b91f87/Statistics_on_new_entrant_QARNNS_officers.pdf
Statistics on the strength of UK armed forces personnel,https://assets.publishing.service.gov.uk/media/5a82016e40f0b62305b91f9b/Statistics_on_the_strength_of_UK_armed_forces_personnel.pdf
Report on the number of armed forces personnel prescribed viagra  ,https://assets.publishing.service.gov.uk/media/5a8212b9e5274a2e87dc1007/Report_on_the_number_of_armed_forces_personnel_prescribed_viagra.pdf
Number of female service personnel taken maternity leave since 2014,https://assets.publishing.service.gov.uk/media/5a8227afe5274a2e87dc16d6/Report_on_the_number_of_female_service_personnel_taken_maternity_leave_since_2014.pdf
Report on the number of complaints and the expenditure on flight operations at RAF Topcliffe since June 2011,https://assets.publishing.service.gov.uk/media/5a82051ded915d74e62355a5/Report_on_the_number_of_complaints_and_the_expenditure_on_flight_operations_at_RAF_Topcliffe_since_June_2011__2_.pdf
Report on the environmental impact HMS Queen Elizabeth aircraft carrier could cause on arrival to Gosport  ,https://assets.publishing.service.gov.uk/media/5a820f72ed915d74e340182e/Report_on_the_environmental_impact_HMS_Queen_Elizabeth_aircraft_carrier_could_cause_on_arrival_to_Gosport.pdf
Instruction manual for Leyland DAF T244-4-tonne 4x4 lorry,https://assets.publishing.service.gov.uk/media/5a820036ed915d74e6235409/Instruction_manual_for_Leyland_DAF_T244-4-tonne_4x4_lorry.pdf
Information on the number of civilians given state honour in 2016,https://assets.publishing.service.gov.uk/media/5a81d14c40f0b62305b90f81/Information_on_the_number_of_civilians_given_state_honour_in_2016.pdf
 Number of Ministry of Defence (MOD) lottery tickets purchased recently ,https://assets.publishing.service.gov.uk/media/5a82046ced915d74e340148d/Number_of_Ministry_of_Defence__MOD__lottery_tickets_purchased_recently.pdf
 Ministry of Defence police (MDP) report on crimes committed by children aged 10 and under ,https://assets.publishing.service.gov.uk/media/5a82e04fed915d74e3404037/Ministry_of_Defence_police__MDP_report_on_crimes_committed_by_children_aged_10_and_under.pdf
Statistics on income generated by Joint Helicopter Command (JHC) at public events,https://assets.publishing.service.gov.uk/media/5a82c5a840f0b62305b94432/Statistics_on_income_generated_by_Joint_Helicopter_Command__JHC__at_public_events.pdf
Statistics on the number of army personnel transferred to the welfare service from 2014 to 2015 ,https://assets.publishing.service.gov.uk/media/5a822110ed915d74e3401e12/Statistics_on_the_number_of_Army_personnel_transferred_to_the_welfare_service_from_2014-2015.pdf
Statistics on RAF nurses promoted to commissioned officer  from 2012 to 2016,https://assets.publishing.service.gov.uk/media/5a82c39be5274a2e8ab593b8/Statistics_on_RAF_nurses_promoted_to_commissioned_officer__from_2012-2016.pdf
Statistics on number of candidates applied for commisioned post  as Provost officers over the last 5 years  ,https://assets.publishing.service.gov.uk/media/5a823400e5274a2e87dc1af6/Statistics_on_number_of_candidates_applied_for_commisioned_post__as_Provost_officers_over_the_last_5_years.pdf
British task force campaign to liberate the Falkland Islands in 1982,https://assets.publishing.service.gov.uk/media/5a74cb9340f0b61df47788d1/British_task_force_campaign_to_liberate_the_Falkland_Islands_in_1982.pdf
Claims for sexual offences from the armed forces compensation scheme since 2015,https://assets.publishing.service.gov.uk/media/5a82e82eed915d74e34042ae/Claims_for_sexual_offences_from_the_armed_forces_compensation_scheme_since_2015.pdf
Number of Elizabeth Crosses awarded to deceased military personnel,https://assets.publishing.service.gov.uk/media/5a81d63fed915d74e6234619/20170317-FOI2017_01387-OSP_001.pdf
 No provisions in place for applicants joining the services with Gaelic as their first language,https://assets.publishing.service.gov.uk/media/5a81e96ced915d74e3400b8e/Gaelic_as_a_first_language_in_the_armed_service.pdf
Documents made available for Nuclear test veterans' claims tribunal,https://assets.publishing.service.gov.uk/media/5a81c622e5274a2e8ab55bfb/Nuclear_test_veterans__claims.pdf
Procurement of HMS Illustrious,https://assets.publishing.service.gov.uk/media/5a74f9c6ed915d502d6cc83f/Procument_of_HMS_Illustrious.pdf
Number of UK air strikes in Iraq and Syria,https://assets.publishing.service.gov.uk/media/5a81d83740f0b62305b911c3/Number_of_UK_air_strikes_in_Iraq_and_Syria_and_US_unmanned_aircrafts.pdf
Operational cost of HMS Dauntless from 2015 to 2016,https://assets.publishing.service.gov.uk/media/5a74a675e5274a5294069113/Operational_cost_of_HMS_Dauntless_from_2015_to_2016.pdf
Request copy of Defence Council Instructions (DCI) information on general service medals,https://assets.publishing.service.gov.uk/media/5a81e667ed915d74e3400a85/Defence_Council_Instructions__DCI__information_on_general_service_medals.pdf
Report on the Atlantic patrol task operation in the Caribbean from 2000 to 2016,https://assets.publishing.service.gov.uk/media/5a82190240f0b62305b9277a/Report_on_the_Atlantic_patrol_task_operation_in_the_Caribbean_from_2000_to_2016.pdf
Information on financial assistant for the education of service children attending boarding schools,https://assets.publishing.service.gov.uk/media/5a81cdbbe5274a2e8ab55e95/Information_on_financial_assistant_for_the_education_of_service_children_attending_boarding_schools.pdf
Statistics on drug offences identified in the armed forces from 2015 to 2016,https://assets.publishing.service.gov.uk/media/5a82ada0ed915d74e3403029/Statastics_of_drug_offences_identified_in_the_armed_forces_from_2015-2016.pdf
Statistic on the number of Royal Air Force (RAF) aircraft contained within the forward and sustainment fleets,https://assets.publishing.service.gov.uk/media/5a821bd7e5274a2e8ab5789d/Statistic_on_the_number_of_Royal_Air_Force__RAF__aircraft_contained_within_the_forward_and_sustainment_fleets.pdf
Number of sorties flown by the 100 Squadron Hawks annually,https://assets.publishing.service.gov.uk/media/5a75b7aeed915d506ee80f75/Report_on_the_number_of_sorties_flown_by_the_100_Squadron_Hawks_annually.pdf
Number of abuse allegations made by young people under 18 years old against personnel from military cadets forces in Scotland from 2014 to 2015,https://assets.publishing.service.gov.uk/media/5a8204e6e5274a2e8ab57126/Report_of_sexual_allegation_on_victims_under_aged_18_by_military_and_civilian_personnel_in_Scotland_from_2014_to_2015.pdf
Information on Ministry of Defence police (MDP) dog equipment,https://assets.publishing.service.gov.uk/media/5a82dda3ed915d74e3403f62/Information_on_Ministry_of_Defence_police__MDP__dog_equipment.pdf
Statistics on army recruits aged 22 and 24 completed the length of service,https://assets.publishing.service.gov.uk/media/5a82c63c40f0b6230269ca1c/Statistics_on_Army_recruits__aged_22_and_24_completed_the_length_of_service.pdf
Number of regular trained soldiers who resigned prior to completing 4 years service from 2012 to 2017,https://assets.publishing.service.gov.uk/media/5a81d36aed915d74e6234511/Number_of_regular_trained_soldiers_who_resigned_prior_to_completing_4_years_service_from_2012_to_2017.pdf
Report on the number of foreign nationals arrested by Ministry of Defence police (MDP),https://assets.publishing.service.gov.uk/media/5a822bf540f0b6230269b374/Report_on_the_number_of_foreign_nationals_arrested_by_Ministry_of_Defence_police__MDP_.pdf
Ministry of Defence police (MDP) report on items seized and sold under the proceeds of crime act from 2013 to 2014,https://assets.publishing.service.gov.uk/media/5a82a103ed915d74e6236d0e/Ministry_of_Defence_police_MDP__report_on_items_seized_and_sold_under_the_proceeds_of_crime_act_from_2013_to_2014.pdf
Statistical data on how travel time to Northern Ireland is classified within CAAS methodology,https://assets.publishing.service.gov.uk/media/5a81d69b40f0b623026996f1/Statistical_data_on_how_travel-time_to_Northern_Ireland_is_classified.pdf
Information on the closure of 56 military sites on the defence estate,https://assets.publishing.service.gov.uk/media/5a82095040f0b6230269a7d9/Information_on_the_closure_of_56_military_sites_on_the_Defence_Estate.pdf
Number of lifts at the UKHO's Admiralty Way site,https://assets.publishing.service.gov.uk/media/5a8207e9e5274a2e87dc0c92/Statistics_on_the_number_of_lifts_at_the_UKHO_s_Admiralty_Way_site.pdf
Information on medal entitlement for war veteran during 1939 to 1945 ,https://assets.publishing.service.gov.uk/media/5a81fa00ed915d74e62351f6/Information_on_medal_entitlement_for_war_veterans_during_1939-45.pdf
Ministry of Defence (MOD) empty properties for sale during 2016,https://assets.publishing.service.gov.uk/media/5a75666be5274a1baf95e467/Ministry_of_Defence__MoD__empty_properties_for_sale_during_2016.pdf
Report on operational top hat: government expedition to Rockall in 1970,https://assets.publishing.service.gov.uk/media/5a8017fbe5274a2e87db7d06/Report_on_Operational_Top_Hat_government_expedition_to_Rockall_in_1970.pdf
Statistics  on RAF quick reaction response to Russian military aircraft between 2000 to 2016,https://assets.publishing.service.gov.uk/media/5a807127e5274a2e8ab502b1/Statistics__on_RAF_Quick_Reaction_response_to_Russian_military_aircraft_between_2000-2016.pdf
Report on training injuries at the Otterburn Military Camp from  2014 to 2016,https://assets.publishing.service.gov.uk/media/5a817233ed915d74e62324ef/Report_on_training_injuries_at_the_Otterburn_Military_Camp_during_2014_2016.pdf
Terms of engagement for the army,https://assets.publishing.service.gov.uk/media/5a80eedfe5274a2e87dbca2f/Terms_of_Engagement_for_the_Army.pdf
Statistics on the number of service personnel leaving the UK armed forces during October 2016,https://assets.publishing.service.gov.uk/media/5a7f2000ed915d74e62288a7/Statistics_on_the_number_of_service_personnel_leaving_the_UK_Armed_Forces_during_October_2016.pdf
Report on top 20 companies awarded non-competitive contracts by the MOD during 2015 to 2016,https://assets.publishing.service.gov.uk/media/5a7f5409e5274a2e87db52f4/Report_on_top_twenty_companies_awarded_non-competitive_contracts_by_the_Ministry_of_Defence__MoD__during_2015-16.pdf
Report on the number of service personnel who left the armed forces over the last 5 years,https://assets.publishing.service.gov.uk/media/5a7f8906ed915d74e622b0e3/Report_on_the_number_of_service_personel_who_left_the_Armed_Force_over_the_last_5_years.pdf
Statistics on the number of armed forces personnel deployable or identified with medical conditions since 2012,https://assets.publishing.service.gov.uk/media/5a80d28640f0b62302695b12/Statistics_on_the_number_of_Armed_Forces_personnel_deployable_or_identified_with_medical_conditions_since_2012.pdf
Report on the number of armed forces personnel discharged due to carpal tunnel syndrome from 2009 to 2012,https://assets.publishing.service.gov.uk/media/5a8166b0e5274a2e87dbd6de/Report_on_the_number_of_Armed_Forces_personnel_discharged_due_to_Carpal__Tunnel_Syndrome_from_2009-2012.pdf
Ministry of Defence (MOD) policy on Northern Ireland resident's supplement,https://assets.publishing.service.gov.uk/media/5a7f2ab640f0b62305b857cf/Ministry_of_Defence__MoD__Policy_on_Northern_Ireland_Resident_s_Supplement.pdf
RAF organisational structure of artillery and squadrons ,https://assets.publishing.service.gov.uk/media/5a74be4fed915d502d6caa16/RAF_organisational_structure_of_artillery_and_squadrons.pdf
Sexual offence allegations 2010 to 2015,https://assets.publishing.service.gov.uk/media/5a81730ee5274a2e87dbdb0f/Sexual_offence_allegations_2010-2015.pdf
Ministry of Defence (MOD)  senior staff roles and salaries 2016,https://assets.publishing.service.gov.uk/media/5a74b69240f0b619c8659d27/Ministry_of_Defence__MoD___senior_staff_roles_and_salaries_2016.pdf
British armed forces failed drugs test and dismissals between 2012 to 2016,https://assets.publishing.service.gov.uk/media/5a757d90ed915d731495a5f9/British_Armed_Forces_failed_drugs_test_and_dismissals_between_2012-16.pdf
English and maths GCSE results at Army College Harrogate,https://assets.publishing.service.gov.uk/media/5a75b102e5274a436829939e/English_and_maths_GCSE_results_at_Harrogate_Army_college.pdf
Litigation costings against the Ministry of Defence (MOD) for British nuclear test veterans,https://assets.publishing.service.gov.uk/media/5a82453b40f0b6230269bbeb/Litigation_costings_against_the_Ministry_of_Defence__MOD__for_British_nuclear_test_veterans.pdf
Number of service personnel discharged for illegal drug possession,https://assets.publishing.service.gov.uk/media/5a82bee840f0b6230269c7b6/Number_of_service_personnel_discharged_for_illegal_drug_possession.pdf
Navy Leyal ship recycling contract for HMS Illustrious,https://assets.publishing.service.gov.uk/media/5a75c423e5274a545822e0e2/Leyal_Ship_recycling_contract_for_HMS_Illustrious..pdf
Female engagement in the army,https://assets.publishing.service.gov.uk/media/5a82a28eed915d74e3402c90/Female_engagement_in_the_Army.pdf
Ministry of Defence (MOD) police and civilians illegally accessing the police national computer,https://assets.publishing.service.gov.uk/media/5a81bf52e5274a2e87dbf433/Ministry_of_Defence__MOD__police_and_civilians_illegally_accessing_the_police_national_computer.pdf
 Ministry of Defence (MOD) police data breach from 2013 to 2015,https://assets.publishing.service.gov.uk/media/5a7556d1e5274a59fa71760a/Ministry_of_Defence__MOD__police_data_breach_from_2013_to_2015.pdf
Ministry of Defence (MOD) fisheries protection vessels on operation from 2015 to 2016,https://assets.publishing.service.gov.uk/media/5a82b87bed915d74e62374b0/Ministry_of_Defence__MOD__fisheries_protection_vessels_on_operation_from_2015_to_2016.pdf
Number of service  personnel promoted in the Footguards through the ranks from 2010 to 2016,https://assets.publishing.service.gov.uk/media/5a82dbe640f0b62305b94b91/Number_of_service__personnel_promoted_in_the_Footguards_through_the_ranks_from_2010_to_2016.pdf
Breakdown of personnel strength for Army Legal Service officers,https://assets.publishing.service.gov.uk/media/5a823d64e5274a2e87dc1e19/Army_legal_service_officers.pdf
Number of Ministry of Defence Police (MDP) officers who left the force from 2014 to 2016,https://assets.publishing.service.gov.uk/media/5a823caa40f0b6230269b91a/Number_of_Ministry_of_Defence_MOD_police_officers_who__left_the_force_from_2014_to_2016.pdf
Number of military serving personnel tested positive for steroid abuse from 2015 to 2016,https://assets.publishing.service.gov.uk/media/5a81c812ed915d74e623414a/Number_of__military_serving_personnel_tested_positive_for_steroid_abuse_from_2015_to_2016.pdf
Number of General service 1962 medals and Cyprus 1963 to 1964 medals issued,https://assets.publishing.service.gov.uk/media/5a74e281ed915d502d6cbc5c/General_service_medals_issued_in_1962_and_Cyprus_medals__from_1963_to_1964.pdf
